MovieID;Review ID;SentID;Text;Anotator 1 (Ivan Carević);Anotator 2 (Ema Grahovac);Anotator 3 (Nikolina Pastorčić);Label (Josipa Bebić)
;;XXII;"Odluku da ulogu Anore dade Madison Baker je donio nakon što je vidio njezine izvedbe u filmovima ""Bilo jednom u Hollywoodu"" i ""Vrisak"" (onom iz 2022.).";1;1;1;1
;;XXIII;"Anora je u hrvatska je kina stigla 31. listopada, u kritičar Jutarnjeg lista Damjan Raknić u novoj epizodi serijala ""Šalabahter iz filma"" donosi pet razloga zbog kojih je trebate pogledati.";1;1;1;1
;D;I;Anora, redatelja Seana Bakera, prati jedan period života “eskort-dame”, Anore (Mikey Madison), koja upoznaje Ivana (Mark Eydelshteyn), sina ruskog oligarha.;1;1;1;1
;;II;Mnogi su već komentirali kako je Anora svježa i suvremena verzija priče o Pepeljugi.;1;1;1;1
;;III;No prilikom gledanja, meni se stvorila poveznica na jednu drugu priču i jedan drugi film – Zgodna žena.;1;1;1;1
;;IV;Naravno i za Zgodnu ženu se može reći da je svojevrsna verzija priče o Pepeljugi.;1;1;1;1
;;V;No Anora mi je ostavila dojam kao moderna, realističnija verzija Zgodne žene.;1;0;1;1
;;VI;Anorin život poprima neočekivani zaokret nakon što upozna Ivana.;1;1;1;1
;;VII;Njihova veza, isprva je temeljena na transakciji.;1;1;1;1
;;VIII;Ali ubrzo se razvija u nešto dublje te dovodi do ozbiljne veze koju Ivanovi roditelji ne odobravaju.;1;1;1;1
;;IX;Dapače, šalju svoje ljude po Ivana i Anoru kako bi okončali njihovu vezu, a Ivana vratili u Rusiju.;1;1;1;1
;;X;To pokreće niz događaja koji neočekivano balansiraju između komedije i drame.;1;1;1;1
;;XI;Jedan od najsvjetlijih aspekata filma je upravo njegov humor.;0;0;0;0
;;XII;Anora je bez sumnje jedan od najsmješnijih filmova godine.;0;0;0;0
;;XIII;Posebno se ističe scena u kojoj po Ivana i Anoru dolaze ljudi koje su poslali Ivanovi roditelji.;1;1;1;1
;;XIV;I zapravo od tog trenutka kreću najduhovitiji dijelovi filma.;0;0;0;0
;;XV;Ali oni su cijelo vrijeme prožeti vrlo tužnom pričom koja nas udari tek pred kraj filma.;1;1;1;1
;;XVI;Jer ispod površine humora, Anora se bavi i teškim temama poput klasnih razlika, identiteta i potrage za vlastitim mjestom u svijetu.;1;1;1;1
;;XVII;I vjerojatno je ova kombinacija humora i ozbiljnosti razlog zašto je Anora osvojila brojnu publiku.;0;0;0;0
;;XVIII;Osim toga, glumačka postava je izvanredna.;0;0;0;0
;;XIX;Mikey Madison briljira u ulozi Anore, donoseći liku slojevitost i autentičnost.;0;0;0;0
;;XX;Njezina izvedba zasluženo je nominirana za Oscara.;0;0;0;0
;;XXI;Yura Borisov također se ističe u ulozi Igora, jednog od ljudi poslanih da zaustave Anorinu i Ivanovu vezu.;1;0;1;1
;;XXII;On je Igoru donio suptilnost i dubinu.;0;0;0;0
;;XXIII;No doista se može reći kako je cijela glumačka postava jako dobra i zapravo je teško izdvojiti pojedinačne glumce.;0;0;0;0
;;XXIV;Ali ipak sam to morao to napravit bar za ovaj dvojac koji je nominiran za Oscara.;1;1;1;1
;;XXV;Anora je film koji će vas nasmijati, dirnuti i možda potaknuti na razmišljanje.;0;0;0;0
;;XXVI;Njegova sposobnost da spoji humor s ozbiljnim temama, zajedno s izvanrednim glumačkim izvedbama i vještom režijom, čini ga jednim od najboljih filmova godine.;0;0;0;0
;;XXVII;U konačnici, Anora nije samo moderna verzija Zgodne žene.;1;1;1;1
;;XXVIII;To je duboko promišljanje o ljubavi, identitetu i društvenim normama.;1;1;1;1
;;XXIX;Njezina realistična i iskrena priča, zajedno s humorom, garancija je da će ostati u sjećanju gledatelja dugo nakon završetka projekcije.;0;0;0;0
;;XXX;Uostalom, zato je i uspjela dobiti nekoliko nominacija za Oscara, iako je riječ o tipu filma kojeg bi Akademija inače izbjegla.;1;1;1;1
;;XXXI;Zato… bacite oko na Anoru.;0;0;0;0
;E;I;Sean Bakerova neuobičajena priča o Pepeljugi osvojila je prestižnu nagradu Zlatna palma, a svjetski kritičari i filmaši predviđaju joj pozlaćene kipiće na Oscarima iduće godine.;1;1;1;1
;;II;Stilski uzbudljiva, iznimno zabavna i emocionalno iskrena, Anora je jedinstvena varijacija na priču o Pepeljugi koja može doći samo od Seana Bakera.;0;0;0;0
;;III;Bakera se može nazvati indie filmašem, ali Anora je pravi mainstream film koji će sa svojom energijom i temom u istoj mjeri zadovoljiti poklonike indie filma, blještavog mainstreama, kao i modernu ‘TikTok’ publiku.;0;0;0;0
;;IV;Zvuči nevjerojatno, ali je doista tako.;0;0;0;0
;;V;To je film koji se konstantno poigrava s očekivanjima publike od samog početka.;1;1;1;1
;;VI;Hollywood nas je naučio da kad striptizete imaju posla sa sumnjivim Rusima i njihovim poslovima, ishod je uvijek mračan i tragičan.;1;1;1;1
;;VII;Anora preokreće takvu priču naglavačke, publici stalno pruža iznenađenja, i baš zbog toga ga nazivaju jednim od najsmješnijih i najzabavnijih filmova godine.;0;0;0;0
;;VIII;Mada su glavni likovi filma escort djevojka (koja ne voli da ju se tako naziva), razmaženi bogatašev sin, i ruski snagatori – oni nisu ono što očekujete i što ste još do sada imali prilike vidjeti.;1;1;1;1
;;IX;Anora prati istoimenu striptizetu (Mikey Madison) koja se impulzivno uda za razmaženog sina (Mark Eidelshtein) moćnog ruskog biznismena.;1;1;1;1
;;X;Njegovi roditelji u Rusiji saznaju za brak njihovog sina i nastoje pod svaku cijenu raskinuti njihovu vezu.;1;1;1;1
;;XI;Stvari se dodatno zakompliciraju kad mladoženja pobjegne, dok ga Anora i ruski snagatori nastoje uhvatiti.;1;1;1;1
;;XII;Baš kada se učini da se film uklapa u ritam ljubavne priče, on preskače žanrovske staze i postaje propulzivan, mračno smiješan film potjere koji kruži ulicama Brighton Beacha, Coney Islanda i Manhattana.;1;0;1;1
;;XIII;“Mikey Madison, oskarovska nova Pepeljuga, predvodi skupinu luđaka kao seksualna radnica koja pronalazi svog princa u sinu opasnog ruskog oligarha.;1;1;1;1
;;XIV;Nijedan popis najboljih filmova godine ne bi bio potpun bez vrtloga zabave i društvene provokacije Seana Bakera.;0;0;0;0
;;XV;“Iznenadit ćete se koliko ćete se brzo posvetiti ovom jedinstvenom iskustvu.'';0;0;0;0
;;XVI;“Velika, odvažna, sjajna i vrlo smiješna, razularena komedija koja nije nalik ničemu drugom u Bakerovoj filmografiji.”;0;0;0;0
;;XVII;“Izuzetno zabavna, suvremena screwball komedija smještena u 2018. koja juri kroz New York i Las Vegas.;0;0;0;0
;;XVIII;'Mikey Madison je pravo otkriće.”;0;0;0;0
;;XIX;“Anora vrvi od energije i urnebesnim trenucima, ali se ne preporučuje osobama s visokim krvnim tlakom.”;0;0;0;0
;;XX;Kao što je Zgodna žena lansirala Juliju Roberts među hollywoodske zvijezde, Anora će nesumnjivo učiniti isto za Mikey Madison koja je u naslovnoj ulozi filma.;0;0;0;0
;;XXI;Madison je šarmantna, nepristojna, urnebesna, hrabra, i graciozna u ulozi Anore gdje je nemoguće ne zaljubiti se u nju, i to zbog njene izvrsne glume.;0;0;0;0
;;XXII;Baš zbog svega navedenog, svi koji su pogledali film za mladu glumicu predviđaju mnoštvo nagrada, a vjerojatno ona najsjajnija je i Oscar nominacija za najbolju žensku ulogu.;0;0;0;0
;;XXIII;Da ne bi bilo zabune, apsolutno sve glumačke izvedbe su predobre da bi se propustile, ali Mikey Madison je nešto posebno.;0;0;0;0
;;XXIV;“Jako mi se svidio film i moram što prije raditi s Mikey Madison,” izjavio je jedan producent nakon projekcije Anore na Telluride Film Festivalu za Variety.;0;0;0;0
;;XXV;S obzirom na to da se za sve projekcije Anore na festivalima tražila ulaznica više, izgleda da se 25-godišnjoj glumici koja se proslavila ulogama u filmovima Vrisak i Bilo jednom.. u Hollywoodu sprema titula najmlađe glumice u utrci za pozlaćenog kipića.;1;1;1;1
;;XXVI;Što se tiče Seana Bakera koji je svoju viziju Anore prenio na velike ekrane, on bi u malo većoj konkurenciji mogao biti četverostruko nominiran poput Chloé Zhao 2021. za film Zemlja nomada – kao producent, redatelj, scenarist, i montažer.;1;1;1;1
;;XXVII;Možda su njegovi filmovi eksplicitniji od svega onog na što se inače naviknulo na Oscarima, ali ako Anoru obožavaju kritičari, publika, producenti, i zapravo svi koji su ga pogledali – nema razloga da ga i Akademija neće obožavati, a možda i nagraditi.;0;0;0;0
;;XXVIII;Ovog listopada saznajte o kakvom fenomenu se ovdje radi jer Anora dolazi u hrvatska kina 31.10.;1;1;1;1
;F;I;„I like Anora.“;0;0;0;0
;;II;Često se u filmofilskim pričama može čuti kako više ne postoje mali nezavisni filmovi, odnosno redatelji koji ih snimaju.;1;1;1;1
;;III;No, to ne može biti dalje od istine jer oni itekako postoje, samo trebate dopustiti da se međusobno pronađete.;1;1;1;1
;;IV;Isto kao i u životu, i to s pravim osobama koje će vas u svakom mogućem pogledu oduševiti i obogatiti, bilo svojim izgledom, osobnošću i općenito pogledom na svijet.;0;0;0;0
;;V;Jedan od takvih ljudi, u filmskom smislu, svakako je Sean Baker, za mene jedan od najboljih nezavisnih filmaša.;0;0;0;0
;;VI;Pa iako je Baker već više od dva desetljeća dio popularne kulture, nekako mi se čini kako ni približno nema status koji zaslužuje.;2;2;2;2
;;VII;Ono što je mene uvijek privlačilo kod njegovih filmova u prvom je redu bio način na koji je portretirao svoje likove, odnosno priče ljudi s ruba društva, bilo da se radi o imigrantu bez dokumenata u New Yorku (Take Out), uličnom prevarantu (Prince of Broadway), neobičnim prijateljstvima između porno glumice i udovice (Starlet), seksualnoj radnici u potrazi za svodnikom, snimljenim na pametnom telefonu (Tangerine), odnosu majke i kćeri, djetinjstvu, odrastanju, životu (Projekt Florida) ili studiju karaktera (Red Rocket).;0;0;0;0
;;VIII;Sve su ovo filmovi u kojima je Baker prikazao marginalizirane zajednice s dostojanstvom i staloženošću.;1;1;1;1
;;IX;Baker ima empatiju prema likovima, odnosno prema boli koju osjećaju u svojim svjetovima.;1;1;1;1
;;X;Čini se kako je Bakeru baš stalo da svi ti ljudi zavole njegove filmove, želi da ih pravilno predstavi, dok s druge strane sve te priče svih tih supkultura istovremeno izazivaju publiku i zadržavaju Bakerov prepoznatljivi empatični i duhoviti štih.;0;0;0;0
;;XI;Baker portretira američki san kojeg svi žele živjeti, ali kroz oči onih ljudi koji su odbačeni od društva i koji za takav san imaju jako male šanse.;1;1;1;1
;;XII;Njegov najnoviji film „Anora“ svakako je najambiciozniji u njegovoj karijeri i nakon što sam ga prije par dana opet pogledao u kinu mogu slobodno reći kako mi je Ani, pardon Anora zavela srce na sve moguće načine.;0;0;0;0
;;XIII;Poput neke posebne osobe koja neplanirano uđe u život.;1;1;0;1
;;XIV;Ani, pardon Anoru možemo vidjeti na različitim mjestima, a jednako tako i njenu različitu osobnost.;1;1;1;1
;;XV;Anora je drukčija na poslu, u odnosu s klijentima i privatno.;1;1;1;1
;;XVI;Baker tako prikazuje i nama kako nema ništa loše u tome da imamo različite verzije sebe koje prezentiramo drugim ljudima.;1;1;1;1
;;XVII;To je sve ljudski i normalno.;1;1;1;1
;;XVIII;Na nama je da izaberemo kome ćemo spustiti zastor i pustiti ga u naš mali svijet.;1;1;1;1
;;XIX;Ova moja (ne)namjerna greška oko imena je simbolična.;1;1;1;1
;;XX;Jer Ani radi izvedbu na poslu, prilagođavajući se tako drugima, dok njeno pravo lice malo tko vidi.;1;1;1;1
;;XXI;Zato Anoru čuva samo za posebne ljude.;1;1;1;1
;;XXII;U jednom je trenutku mrzi jer misli kako polako nestaje.;1;1;1;1
;;XXIII;Baker tako njen lik ne čini empatičnim, nešto kao što je to napravila Lizzie Borde u „Working Girls“.;1;1;1;1
;;XXIV;Prvi kadrovi filma odmah vas uvode u svijet glavne junakinje, kada Baker načinom snimanja spaja narativnu fikciju s nekom vrstom dokumentarca.;1;1;1;1
;;XXV;I uistinu se taj dio i čini kao da gledamo stvarni svijet Anore i njenih kolegica dok zavodljivo plešu u klubu za klijente u odvojenim prostorijama.;0;0;0;0
;;XXVI;No, za razliku od većine filmova koji se bave temom seksualnih radnica, a gdje su većinom stavljene u neke sporedne likove ili karikatura prikaze, Baker spaja univerzalnu priču s potpuno razrađenim, višedimenzionalnim likovima, odnosno razmišlja o tome na drugačiji način – prirodniji, realniji, životniji.;0;0;0;0
;;XXVII;Baker razmišlja izvan okvira i kako postići već viđenu temu na različiti način.;1;1;1;1
;;XXVIII;Kao da mu je u cilju da društvo što više odbaci stigmu koje ima prema tim društvenim skupinama, spajajući komediju i socrealizam Mikea Leigha i Ernsta Lubitscha, i to mu u velikoj mjeri i uspijeva.;1;1;1;1
;;XXIX;Anora je film koji jako dobro balansira filmske žanrove.;0;0;0;0
;;XXX;Baker u stilu Anore pleše između romantike, slapstick komedije i na koncu drame.;1;1;1;1
;;XXXI;Potonja postaje sve jasnija i izraženija kako film ide naprijed.;1;1;1;1
;;XXXII;No, uz sve to, film je istovremeno melankoličan i urnebesan.;0;0;0;0
;;XXXIII;I tu Baker radi genijalnu stvar, kada nas u samom početku uvodi u tu romantičnu komediju, neku vrstu bajke koju živi glavna junakinja filma, da bi nas s odmakom vremena odmaknuo u surovu realnost kada se romansa ruši na onaj tvrdi i hladni beton ulica New Yorka i kada, i kada s Anorom, postajemo tragači u potrazi za odgovorima.;0;0;0;0
;;XXXIV;Ova postavka radnje filma, a koja se okreče poput rolerkostera, u savršenoj je simbiozi s Anorinim likom, odnosno njenim karakterom.;0;0;0;0
;;XXXV;Uostalom, ovo i jest njena „bajka“, odnosno njezino ostvarivanje i buđenje (iz) sna.;1;1;1;1
;;XXXVI;No, Baker ne daje samo Anori otrežnjenje iz realnosti, već i svima nama u kinu, posebice nakon prvog sata filma koji djeluje kao savršena kratkometražna romantična komedija.;0;0;0;0
;;XXXVII;Baker je u tom trenutku mogao slobodno napraviti rez.;1;1;1;1
;;XXXVIII;Anora upoznaje bogatog sina ruskog oligarha u kojeg se zaljubljuje, nakon kratkog vremena se vjenčaju i zajedno žive američki san.;1;1;1;1
;;XXXIX;Da je u tom trenutku, a postoji jedan savršeni široki kadar u kojem vidimo vilu u kojoj žive, Baker napravio rez, bila bi to bajka koju smo živjeli s brojnim filmskim likovima.;0;0;0;0
;;XL;No, Baker nas, za razliku od mnogih, uvodi s Anorom u surovu realnost, odnosno u lažan osjećaj sigurnosti.;1;1;1;1
;;XLI;S odmakom radnje zapravo shvaćamo kako je sve to bilo prisutno od samog početka samo smo sve to propustili, ali smo tako ušli u cipele glavnih likova.;1;1;1;1
;;XLII;U početku je to odnos Vanje (jako dobar Mark Eydelshteyn) i Ani (Mikey Madison).;1;1;1;1
;;XLIII;Vanja je razmaženi bogataš kojeg potpuno drugačije doživljavamo na samom početku, pa čak i na emotivnom planu.;1;1;1;1
;;XLIV;On je i razlog svega onoga što će se događati s Ani.;1;1;1;1
;;XLV;Kroz njegov lik Baker postavlja i neka klasna pitanja uvodeći nas u svijet bogataša u kojem ne pripadamo, jednako kao ni Ani.;1;1;1;1
;;XLVI;Ona je autsajder, ali ih se ne boji, pa čak i kad joj prijete.;1;1;1;1
;;XLVII;To je jako zanimljiva dinamika i putovanje s likovima, a što stvara kod nas različite poglede prema njima.;0;0;0;0
;;XLVIII;Neke tako na početku mrziš da bi ih na kraju zavolio.;0;1;1;1
;;XLIX;I obrnuto, neki su ti simptični u uvodu dok ih na kraju ne možeš smisliti.;2;2;2;2
;;L;Baker cijelo vrijeme stavlja fokus na Anoru, našu romantičnu heroinu koja je istovremeno drska, neustrašiva, slomljena, ali samo na trenutke sretna.;1;1;1;1
;;LI;U tim sretnim trenucima zapravo i najbolje vidimo njenu melankoličnu tugu, odnosno cijeli spektar emocija koji tada nenamjerno otkriva.;0;0;0;0
;;LII;Primjerice, nakon što se uda za Vanju, i kada u pozadini čujemo zarazan hit Greatest Day.;1;1;1;1
;;LIII;U jednom trenutku u kadru postoji samo ona, nitko drugi.;1;1;1;1
;;LIV;Vanja je izvan kadra, nestao je, ne postoji.;1;1;1;1
;;LV;Vidimo samo Anoru kako je istinski sretna, nikoga drugoga.;1;1;1;1
;;LVI;Predivna simbolika za lik jer na koncu to i jest bila njena odluka, njoj je to značilo sve i za nju je to uistinu bio najbolji mogući dan u životu.;0;0;0;0
;;LVII;Baker nas tako uvlači u Anorine emocije dok upijamo zrcalo njenog lica, a kroz koje predviđamo kako će događaji koji slijede utjecati na nju kao osobu.;1;1;1;1
;;LVIII;Tako zadržavamo scenu i trenutak koji živimo s Anorom.;1;1;1;1
;;LIX;Refren pjesme, simbolično i namjerno točno zumira njeno lice kao savršen kadar trenutka.;0;0;0;0
;;LX;Baker često zumira lice Anore, a što najviše dolazi do izražaja na velikom platnu.;1;1;1;1
;;LXI;Također, ekstremno široki kadrovi također odgovaraju radnji i njenim osjećajima.;0;0;0;0
;;LXII;Baker nas privlači njenom liku kroz oči i tako stavlja fokus na detalje, u kojima i njen vrisak postaje prikaz obrambenog karaktera.;1;1;1;1
;;LXIII;Baker nas kroz njene oči i uvodi kroz taj zbunjeni i izgubljen osjećaj koji trenutačno proživljava.;1;1;1;1
;;LXIV;Ona se osjeća većinom usamljeno, i baš tada njena osobnost najviše dolazi do izražaja kada pokušava shvatiti svijet u kojem se (pro)našla.;1;1;1;1
;;LXV;Bakerov redateljski pečat i prije je imao tu odvažnost prilikom davanja glavnih uloga nepoznatim glumcima koji iza sebe nemaju neko veliko glumačko iskustvo.;1;1;1;1
;;LXVI;Za Bakera je važna ne samo fizička pojava nego i osobnost koja mora biti intrigantna, a što je u Anori kroz izvedbu Mikey Madison posebno došlo do izražaja.;0;0;0;0
;;LXVII;Nije zato ni čudno što tu hrabrost pokazuje kroz žanrovske odluke, posebno u korištenju humora u svakoj priči, pa čak i ako se radi o tragičnim sudbinama, odnosno i kada se humor na prvi pogled čini neprikladnim.;1;1;1;1
;;LXVIII;Humor u mračnim trenucima za likove nije stran za Bakera, pa ga tako i koristi i u Anori i to kroz interakciju između likova, a čime uspješno naglašava apsurdnost situacije i radi ravnotežu različitih žanrovskih tonova.;0;0;0;0
;;LXIX;No, za razliku od prethodnih filmova koji su imali raznobojne palete boja, ovdje je više fokus na crvenoj boji a koji možemo vidjeti u većini kadrova, bilo da se radi o običnom rekvizitu, odjeći koju nosi Anora ili šljokicama koje ima u kosi, a što stvara dodatnu vizualnu privlačnost.;1;0;0;0
;;LXX;Njen izgled me u velikoj mjeri podsjetio na film „Vampyros Lesbos“, odnosno Soledad Mirandu koja je u njemu također nosila crveni šal, a sama njena pojava, duga crna kosa, jako je sličan Mikey Madison u Anori.;1;1;1;1
;;LXXI;Tu je još i očita referenca na Godardov „Prijezir“, gdje također svaki kadar ima neku određenu posebnost i usklađenost.;0;0;0;0
;;LXXII;Crvena boja, odnosno izgled Anore, u velikoj mjeri i diktira izgled filma.;1;1;1;1
;;LXXIII;Kad smo već kod izgleda, lokacije na kojima se snimao film je također jako bitna.;1;1;1;1
;;LXXIV;Baker uspijeva prikazati modernu priču kroz atmosferu kinematografije 70-ih.;0;0;0;0
;;LXXV;Noćne snimke i kadrovi New Yorka jako podsjećaju na stil Josepha Sargenta i Otmicu metroa 123 ili u snimateljskom koji je koristio Owen Roizman u Francuskoj vezi.;1;1;1;1
;;LXXVI;Baker tako stvara starinski, klasični, kinematografski izgled i ljepotu na mjestima koje prikazuje, bez obzira koliko bili otrcani, prljavi i obični.;0;0;0;0
;;LXXVII;Baker kroz komunikaciju s likovima stvara energiju filmova Fellinija, neorealizma, samo što je njegov malo topliji, poput šalice čaja u hladnoj zimskoj večeri.;0;0;0;0
;;LXXVIII;Socrealistički filmovi većinom jesu sivi, tmurni, mračni, a što metaforički često oslikava unutarnje stanje likova, no Baker izbjegava taj pristup.;1;1;1;1
;;LXXIX;Likovi su zanimljivi, prirodniji i otvoreniji, nema nikakvog glamura u njima.;0;0;0;0
;;LXXX;On ne želi sivilo likova, pa čak i kada prolaze kroz najteže trenutke, on uvijek uspijeva vidjeti i pronaći ljepotu.;0;0;0;0
;;LXXXI;Način na koji Baker stvara kadrove krajolika na jednak način kod gledatelja stvara osjećaj i lakoću pronalaska te iste ljepote koja je svuda oko nas.;0;0;0;0
;;LXXXII;Likovi u filmu nemaju pozadinsku priču, pa tako ni Anora.;2;1;1;1
;;LXXXIII;No, to nam nije ni potrebno jer redatelj želi da živimo u sadašnjem trenutku.;0;0;0;0
;;LXXXIV;Mi učimo o njima kroz situacije u kojima se nalaze.;1;1;1;1
;;LXXXV;Primjerice u samom početku kroz zabavnu interakciju između Ani i Vanje, živimo u trenutku, ne postoji nikakva pozadina, niti nam je potrebna.;0;0;0;0
;;LXXXVI;Njegov život je privlačan za nju, ali ona je iskrena u tom odnosu.;1;1;1;1
;;LXXXVII;Nije zaljubljena, ali vidi potencijal.;1;1;1;1
;;LXXXVIII;Ima posao, ali je “zaigrano dijete koje se samo želi zabaviti.;1;1;1;1
;;LXXXIX;No, istovremeno vjeruje u ljubav i želi je pronaći.;1;1;1;1
;;XC;Čak i kasnije, kada se taj odnos promijeni, mi osjećamo njihove emocije, na drugačije načine i s drugačijim pogledom na njih kao osobe.;1;1;1;1
;;XCI;Tako se najbolje i povezujemo s likovima, i ne samo Anorom.;0;0;0;0
;;XCII;Tu je posebno zanimljiv lik Igora (Yura Borisov) kojeg je Baker, kroz odnos s Anorom, uokvirio savršeno u sam koncept osjećaja filma.;0;0;0;0
;;XCIII;Igora cijelo vrijeme vidimo u Anorinoj pozadini, a što istovremeno može biti neobično utješno ali i zastrašujuće.;0;0;0;0
;;XCIV;Njegova suptilnost u izvedbi stvara vrstu trika koji nam je spremio Baker.;1;1;1;1
;;XCV;Igor je na neki način svaki pojedinac u kinu, stalno je u mraku, te jednako tako pokušava shvatiti što se događa, tko je tko, i na koncu najviše tko je zapravo Anora.;1;1;1;1
;;XCVI;On je zaintrigiran njenom pojavom, a što se ne može sakriti.;1;1;1;1
;;XCVII;On gleda u nju, ali kad ona pogleda u njega on će sramežljivo skrenuti pogled.;1;1;1;1
;;XCVIII;Njihova prva interakcija savršeno je uklopljena u žanrovski ton komedije trenutka i prisutnosti straha, jer on za Ani u prvom trenutku i predstavlja prijetnju i nasilje, te u njemu ne vidi nikakav potencijal.;0;0;0;0
;;XCIX;No, kako film odmiče, tako se i mi, uz Anoru, povezujemo s Igorom i suosjećamo s njim.;0;0;0;0
;;C;Igor tako postaje (i naše) sunce planeta Anora.;0;0;0;0
;;CI;Anora je film baš poput glavnog lika, misteriozno opojna, daje nam potrebu za snovima, idealiziranjem, bajkom koja je nerealna, ali bez obzira svejedno je želimo živjeti.;0;0;0;0
;;CII;Film koji te uhvati za ruku i za koji nemaš pojma gdje će te odvesti, i bez obzira na to što znaš da neće završiti dobro svejedno želiš otići.;0;0;0;0
;;CIII;Kraj filma je zapravo samo početak za Anoru.;1;1;1;1
;;CIV;Kakav?;1;1;1;1
;;CV;To nikad ne saznajemo.;1;1;1;1
;;CVI;Tu štafetu nam daje Sean Baker.;1;1;1;1
;;CVII;Mi smo kreatori njene sudbine.;1;1;1;1
;;CVIII;Katarzu intimnosti koju osjećamo na samom kraju, kroz pahulje snijega koji postaje poput naših emocija, sve veći i snažniji, ostavlja nas, poput Giuliette Masine u filmu „Cabirijine noći“, sa suzom u oku, suzom koja će nas natjerati na razmišljanje i o čemu ćemo poželjeti razgovarati nakon izlaska iz kina.;0;0;0;0
;;CIX;Jer svi smo mi planet Anora u potrazi za svojim suncem.;1;1;1;1
7;A;I;U kinima igra film koji kroz duhovitost, šarm i humor prati nove zgode simpatičnog medvjedića Paddingtona.;0;0;0;0
;;II;Ovo je treći nastavak o ovome medvjediću koji je snimljen po istoimenim knjigama za djecu Michaela Bonda i odvija se u džunglama Perua.;1;1;1;1
;;III;Iako je ovaj intenzivniji nego prethodni i dalje je pravi obiteljski film u kojem će uživati odrasli i djeca.;0;0;0;0
;;IV;A Paddington je i dalje dobrodušan, ali hrabriji i ustrajniji u svojim naumima.;1;1;1;1
;;V;Poruka koju ovaj film jasno šalje djeci je da nikada ne odustaju od onih koje vole i da se preuzimanje rizika i prihvaćanje avanture ponekad može isplatiti.;1;1;1;1
;;VI;Naravno, pod uvjetom da ne dovode u opasnost sebe i ljude iz svoje okoline.;1;1;1;1
;;VII;Film je sinkroniziran na hrvatski jezik i prikazuje se u 2D formatu.;1;1;1;1
;;VIII;Za djecu: 6 + Za roditelje: Zabavni likovi, slapstick gegovi.;1;1;1;1
;;IX;Nasilje: Nasilja ima u pojedinim scenama, ali je prikazano kroz humor i likovi nisu ozlijeđeni.;1;1;1;1
;;X;Zastrašujući prizori: Nema zastrašujućih prizora.;1;1;1;1
;;XI;Rječnik: Rječnik je primjeren djeci.;0;0;0;0
;;XII;Seks: Nema prizora, niti dijaloga seksualne prirode.;1;1;1;1
;;XIII;Samo udvaranja.;1;1;1;1
;B;I;Tempo: Tempo je prilagođen i manjoj djeci.;0;0;0;0
;;II;Treći nastavak ovog filmskog serijala, koji je započeo 2014. s hvaljenim prvijencem, a nastavio priču 2017. s još cjenjenijim nastavkom, slatkog medvjedića i njegovu urnebesnu obitelj Brown vodi iz urbanog Londona na jako drugačiju avanturu u džungle dalekog Perua, odakle je Paddington i potekao.;1;1;1;1
;;III;Nakon što je Paul King radio na prva dva igrano-animirana nastavka o najpopularnijem britanskom medvjediću i prema mnogima bio zaslužan za ogromne uspjehe na kino blagajnama i nagradam, i publika i kritika željno su iščekivali na to kako će treći nastavak s novim redateljsko-scenarističkim timom izgledati.;1;1;1;1
;;IV;Sudeći prema brojkama s britanskog box officea i kritičarskih recenzija, nema straha za obožavatelje ovog serijala, mališane i obitelji diljem svijeta.;1;1;1;1
;;V;Film je u britanskim kinima otvorio još u studenom prošle godine i u startu srušio dva rekorda!;0;0;0;0
;;VI;Imao je najbolje otvaranje za britanski film od Bondovog No Time to Die iz 2021. godine, a otvorio je bolje nego prva dva Paddingtona koja su pokupila brojne nagrade i također oduševila kino gledatelje.;0;0;0;0
;;VII;Na popularnoj stranici Rotten Tomatoes ima ocjenu 93% nakon čak 55 recenzija kritičara.;1;1;1;1
;;VIII;Kad sazna da mu je njegova teta Lucy nestala iz Doma za umirovljene medvjede u džunglama Perua, Paddington i obitelj Brown idu na daleki put i opasnu avanturu kroz prašumu gdje ih čekaju lude zagonetke, misteriozni istraživači i dugo, dugo skrivena tajna mitskog El Dorada…;1;1;1;1
