MovieID;Review ID;SentID;Text;Anotator 1 (Ivan Carević);Anotator 2 (Ema Grahovac);Anotator 3 (Nikolina Pastorčić);Label (Josipa Bebić)
;;XV;Kada otac jednog od petero učenika koji su ostali sami na Božić ipak dođe po svog sina, pozove i sve ostale na skijanje.;1;1;1;1
;;XVI;No, majka jednog od njih, nikako se ne javlja, stoga Paul u školi ostaje sam s njim.;1;1;1;1
;;XVII;Učenik u pitanju je Angus Tully, izrazito pametan, no problematičan tinejdžer.;1;1;1;1
;;XVIII;Paulu i Angusu se pridružuje i školska kuharica Mary, Afroamerikanka koja je nedavno izgubila sina jedinca u ratu u Vijetnamu, a koji je i sam bio učenik u Bartonu.;1;1;1;1
;;XIX;Njih troje tvore neobičnu ‘obitelj’ za Božić koja dijeli svakakve nezgode tijekom dva snježna i hlada tjedna u Novoj Engleskoj.;1;1;1;1
;;XX;No, prava avantura je kako će pomoći jedno drugome da shvate da nisu vezani za svoju prošlost te da mogu odabrati budućnost.;1;1;1;1
;;XXI;Redatelj filma je Alexander Payne, poznat po pametnom kombiniranju komedije i drame.;1;1;1;1
;;XXII;Dvostruki je oskarovac, a oba kipića je dobio za najbolji prilagođeni scenarij za filmove Sideways i The Descendants.;1;1;1;1
;;XXIII;Poznat je i po filmovima Downsizing i Nebraska, a The Holdovers je možda njegov najdirljiviji film dosad.;0;0;0;0
;;XXIV;Payne se ponovno udružio s glumcem Paulom Giamattijem s kojim je surađivao prije skoro 20 godina na filmu Sideways.;1;1;1;1
;;XXV;U ulozi Angusa debitirao je mladi glumac Dominic Sessa, a u ulozi Mary pronašla se Da’Vine Joy Randolph koju smo gledali u seriji Only Murders in the Building.;1;1;1;1
;;XXVI;Payneovi filmovi uvijek briljiraju u području scenarija, a The Holdovers nije ništa drugačiji.;0;0;0;0
;;XXVII;Ovaj put, scenarij je povjeren Davidu Hemingsonu koji je većinom radio na TV serijama.;1;1;1;1
;;XXVIII;Odavno nismo pogledali ovako jedan kvalitetan božićni film koji nije klišej.;0;0;0;0
;;XXIX;Iako je Božić vrijeme veselja, postoje i oni koji su tada često i sami.;1;1;1;1
;;XXX;Tako su se u The Holdoversu skupile tri tužne duše od kojih svatko prolazi kroz svoja teška vremena.;1;1;1;1
;;XXXI;Film je wholesome, emotivan, smiješan i jednostavno jedan od najboljih filmova koje smo pogledali ove godine, a komentari na film su isključivo pozitivni.;0;0;0;0
;;XXXII;Jednostavno vas ne može ostaviti ravnodušnim.;0;0;0;0
;;XXXIII;Iako nije klasični božićni film, The Holdoversova glavna tema je zapravo kako božićne praznike učiniti najboljim mogućim.;1;1;1;1
;;XXXIV;Paul i Angus se u početku filma ne podnose.;1;1;1;1
;;XXXV;Angus radi spačke, Paul je hladan i strog, no do kraja filma sve se to mijenja.;1;1;1;1
;;XXXVI;Iako je smješten u hladne i tmurne zimske dane, The Holdovers uspijeva biti topao i srčan film pa čak i kada se svi od likova svađaju.;1;0;0;0
;;XXXVII;Payne je poznat po crnom humoru u svojim filmovima, a u ovom filmu se savršeno spaja s tugom u likovima.;1;1;1;1
;;XXXVIII;Ono što čini film toliko sjajnim je dinamika između Paula i Angusa.;1;0;0;0
;;XXXIX;Dok na ekranu vidimo kako dani božićnih praznika prolaze, upoznajemo likove sve više.;1;1;1;1
;;XL;Kroz njihovu interakciju pomalo počinjemo shvaćati što ih je učinilo likovima kakvi jesu te osjećamo njihovu bol i frustraciju.;1;1;1;1
;;XLI;Tijekom božićnih praznika Paul i Angus uče jedno o drugome, no pritom nikada ne prestaju sa svađanjem.;1;1;1;1
;;XLII;Međutim, njihov odnos se razvija polako i prirodno, baš onako kako i treba.;1;1;1;1
;;XLIII;Ubrzo shvaćaju da su puno sličniji nego što bi to htjeli.;1;1;1;1
;;XLIV;Do kraja filma Paul se smekša i uz Maryno nagovaranje potrudi se Angusu prirediti bar malo božićnog doživljaja.;1;1;1;1
;;XLV;Njihova veza postane toliko velika da gledajući ih kako jednostavno gledaju knjige na sajmu, jedu skupa u restoranu ili gledaju televiziju postane jednako zanimljivo kao i kada svađaju.;0;0;0;0
;;LVI;Paul Giamatti je jedan od najpodcjenjenijih glumaca današnjice kojeg nekako svi uvijek vole, ali nikad mu ne daju dovoljno hvale.;0;0;0;0
;;XLVII;Giamatti je fenomenalno odigrao ulogu Paula Hunhama i toplo se nadamo kako će dobiti nominaciju za Oscara jer je zaista zaslužuje.;0;0;0;0
;;XLVIII;Glumac je urnebesan sa svojim ‘raskošnim’ uvredama i u filmu vidimo kako je došlo do njegovog hladnog pogleda na svijet, ali kako je on i više od same tvrde površine.;0;0;0;0
;;XLIX;Na početku filma se čini kako će biti još jedan stereotipični zločesti i strogi učitelj, no to nije tako.;1;1;0;1
;;L;Sve zbog Giamattijeve impresivne izvedbe.;0;0;0;0
;;LI;Stvarno vam bude stalno do njegovog lika, čak i u najgorim trenucima.;0;0;0;0
;;LII;Izvanredan je i Dominic Sessa u svojoj prvoj filmskoj ulozi ikad!;0;0;0;0
;;LIII;Glumac je pravo otkriće, a činjenica da može odlično glumiti bok uz bok s Giamattijem obećava.;0;0;0;0
;;LIV;Ne sumnjamo kako je ovo tek njegov početak i kako ćemo ga gledati u scenama s još više glumačkih legendi.;0;0;0;0
;;LV;Ono što nam se posebno svidjelo kod The Holdoversa, a što su i mnogi gledatelji istaknuli jest njegova atmosferičnost.;0;0;0;0
;;LVI;Ne samo da je smješten u 70-e, film izgleda kao da je tada i snimljen.;1;1;1;1
;;LVII;Vizualno izgleda prekrasno.;0;0;0;0
;;LVIII;Estetika 70-ih posebno je prisutna u uvodnoj špici filma, a toplina na ekranu savršeno paše uz atmosferu filma.;0;0;0;0
;;LIX;Sa svojim coming of age elementima koji se miješaju s crnim humorom i dramatičnim događajima, ako bi The Holdovers morali usporediti s nekim drugim filmovima rekli bi da je spoj legendarnog Dead Poets Societyja te Wes Andersonovog Rushmorea.;1;1;1;1
;;LX;Sve u svemu, The Holdovers je božićni film kojeg ne smijete propustiti.;0;0;0;0
;;LXI;Nije sličan niti jednom kojeg smo pogledali ove godine, a voljeli bi da svoj put pronađe i na Oscarima na kojima definitivno zaslužuje nekoliko nominacija.;0;0;0;0
;D;I;The Holdovers film je redatelja Alexandera Paynea i scenarista Davida Hemingsona.;1;1;1;1
;;II;Radnja prati mrzovoljnog učitelja povijesti, Paula Hunhama (Paul Giamatti).;1;1;1;1
;;III;On je zadužen od strane ravnatelja škole, ostati na kampusu tijekom zimskih praznika, kako bi se brinuo o učenicima koji za Božić neće otići kući.;1;1;1;1
;;IV;Među njima se posebno ističe Angus Tully (Dominic Sessa), pametan, ali problematičan učenik.;1;1;1;1
;;V;S njima ostaje i kuharica Mary Lamb (Da’Vine Joy Randolph).;1;1;1;1
;;VI;Ne zato što mora, već zato što želi ostati.;1;1;1;1
;;VII;Ili bolje rečeno, ne želi otići.;1;1;1;1
;;VIII;Uz njih su i brojni poprati likovi koji provode više ili manje vremena na ekranu.;1;1;1;1
;;IX;No ova tri lika i njihovi odnosi, ipak su okosnica ovog filma u vizualnom smislu.;1;1;1;1
;;X;Odnosno, njih najviše gledamo i njihove interakcije najviše pratimo.;1;1;1;1
;;XI;Kao što sam na početku istaknuo, ovdje je doista riječ o neočekivanom božićnom filmu.;1;1;1;1
;;XII;O nečemu što bi u budućnosti mogli rado gledati u prosincu.;0;0;0;0
;;XIII;Pod uvjetom da dobije zasluženu pažnju javnosti.;1;0;1;1
;;XIV;Jer, teško mi je zamisliti da netko pogleda ovaj film i da mu se on ne svidi.;0;0;0;0
;;XV;Može vam biti manje ili više dobar, ali rijetko kome će biti loš.;0;0;0;0
;;XVI;Svojim izgledom neodoljivo vuče na filmove iz 1970-ih i 1980-ih.;0;0;0;0
;;XVII;Je li odluka namjerna ili ne, u to ne ulazim.;1;1;1;1
;;XVIII;Ali film odaje dašak tog vremena i jednog drugačijeg tipa filmova kojeg mnogi vole.;1;1;1;1
;;XIX;Otprilike možete pretpostaviti kuda film vodi.;1;1;1;1
;;XX;Na tom putu, on će vas iznenaditi nekoliko puta.;1;0;0;0
;;XXI;A u konačnici ćete doći do otprilike onakvog cilja kakvog ste očekivali uz još poneki dodatak o kojem niste razmišljali.;1;1;1;1
;;XXII;I jednom kada tamo dođete, bit će vam drago.;1;0;0;0
;;XXIII;Zapravo, cijelim putem razmišljate o tom trenutku i načinu na koji bi se on mogao dogoditi.;1;1;1;1
;;XXIV;Feel-good film s ODLIČNOM glumom;0;0;0;0
;;XXV;The Holdovers ima elemente “feel-good” filma i blagdanskog ozračja.;1;1;1;1
;;XXVI;Sukoba generacija i lekcije kako knjigu nikada ne treba suditi po njenim koricama.;1;1;1;1
;;XXVII;Ugodno me iznenadila i količina humora koja se nalazi u filmu i koja je lijepo raspoređena.;0;0;0;0
;;XXVIII;Čak me na trenutke i iznenadila kada bi bila uparena s nekim nezgodnim događajima.;0;0;0;0
;;XXIX;Konkretno, jednim događajem u sportskoj dvorani koji je ispao urnebesan upravo zbog tog elementa iznenađenja.;0;0;0;0
;;XXX;Posebno zanimljivo u ovom filmu je kako on, osim dobrog scenarija i lijepih vizuala, počiva i na odličnoj glumi.;0;0;0;0
;;XXXI;Dakle, ne okej glumi.;1;1;1;1
;;XXXII;Ne dobroj glumi.;1;1;1;1
;;XXXIII;Nego glumi koja zaslužuje (nominacije za) nagrade.;0;0;0;0
;;XXXIV;Stoga nije slučajno kako su na Zlatnim globusima čak dvije glumačke nagrade otišle u ruke članovima The Holdovers ansambla.;0;0;0;0
;;XXXV;Paul Giamatti nagrađen je kao najbolji glumac u mjuziklu ili komediji, a Da’Vine Joy Randolph kao najbolja sporedna glumica u mjuziklu ili komedije.;1;1;0;1
;;XXXVI;Zapravo, The Holdovers je vrlo uspješno prošao na Zlatnim globusima.;1;0;0;0
;;XXXVII;Osvojio je dva, a bio je nominiran u tri kategorije.;1;1;1;1
;;XXXVIII;Jedina u kojoj je izgubio bila je za najbolji mjuzikl ili komediju.;1;1;1;1
;;XXXIX;Tu je pobjedu odnio film Poor Things.;1;1;1;1
;;XL;Stoga, bez obzira na to što je Božić iza nas, toplo preporučujem gledanje The Holdovers.;1;1;1;1
;E;I;The Holdovers' sadrži sve komponente koje ga čine božićnim filmom - odvija se u vrijeme Božića, govori o zbližavanju tužnih i izgubljenih ljudi, topao je u ledenom i snježnom okruženju, ima scena s lampicama, jelkama, girlandama.;1;1;1;1
;;II;No njegove su emotivne finese, fantastične glumačke izvedbe i majstorsko miješanje okrutnosti s blagošću, tuge s humorom - suviše izvanserijske da bismo film utrpali u niz šprancerskih blagdanskih zicera.;0;0;0;0
;;III;Najnoviji film Alexandera Paynea, koji odnedavno igra u našim kinima pod svojim izvornim, neprevedenim naslovom 'The Holdovers', mogao bi vas na štošta podsjetiti.;1;1;1;1
;;IV;Primjerice, na 'Društvo mrtvih pjesnika' jer je i ovdje riječ o elitnoj američkoj privatnoj školi-internatu i o učeniku i učitelju koji jedan drugome mijenjaju život.;1;1;1;1
;;V;Mogao bi vas, iz sličnih razloga, podsjetiti i na 'Miris žene' jer je riječ o polazniku privatne škole koji za blagdane ne ide k obitelji, nego ih provodi s nadrkanim sredovječnim muškarcem koji ima problema s vidom.;1;1;1;1
;;VI;Tu su, naravno, i namjerne stilske referencije samog redatelja - film se odvija na prijelazu iz 1970. u 1971. pa se Payne svojski potrudio da film i izgleda i zvuči kao film iz sedamdesetih, a sa sedamdesetima dijeli i to što je po sadržaju sličan filmovima iz te dekade - fokusiran je na likove i malo baca na neke filmove Bogdanovicha, Ashbyja, čak Altmana.;1;1;1;1
;;VII;Najviše od svega, ovo je božićni film i u njemu ćete prepoznati elemente nekih božićnih klasika.;1;1;1;1
;;VIII;No točno onoliko koliko 'The Holdovers' podsjeća na sve te filmove i stilove, toliko se od njih i razlikuje.;1;1;1;1
;;IX;Tako i mora biti, zar ne?;1;1;1;1
;;X;Zašto bi se inače uopće snimao?;1;1;1;1
;;XI;OK, tvorci bezbrojnih remakeova, franšiza i nastavaka imali bi polemičan odgovor na to pitanje, ali ovo je ipak Alexander Payne.;1;1;1;1
;;XII;On ne štanca kopije.;1;1;1;1
;;XIII;Prije svega, ovaj se film od 'Društva mrtvih pjesnika' razlikuje zato što je u njegovu središtu učitelj koji nije ni najmanje inspirativan.;1;1;1;1
;;XIV;Paul Giammatti ovdje (savršeno) glumi Paula Hunhama, profesora klasične kulture u elitnom internatu Barton, mrzovoljnog, ciničnog i podosta krutog profesora kojeg nitko ne voli - ni učenici ni kolege.;1;1;1;1
;;XV;Paul i ne očekuje simpatije.;1;1;1;1
;;XVI;U jednom briljantnom redateljskom potezu na početku samog filma Alexander Payne otkriva nam o kakvom je čovjeku riječ, prelazeći kamerom po stvarima u njegovu pomalo kaotičnom stanu.;0;0;0;0
;;XVII;Na Paulovu umivaoniku, bez ikakvog skrivanja i maskiranja, stoji napola potrošena tuba masti protiv hemoroida.;1;1;1;1
;;XVIII;Očito je riječ o čovjeku koji ne prima i ne očekuje posjete.;1;1;1;1
;;XIX;U kratkom prikazu Paulova profesionalnog života - dok ispravlja testove, drži zadnji sat učenicima prije božićnih praznika i dok razgovara s ravnateljem - saznajemo i kako je došlo do toga da Paul nikome nije ni drag ni simpatičan.;1;1;1;1
;;XX;Nisu okrutnost, sadizam, cinizam i samoživost ono zbog čega se Paul ponaša abrazivno - on samo pogrešno misli da ih tako skreće s krivog puta.;1;1;1;1
;;XXI;S kolegama se ne slaže jer ih otvoreno osuđuje zbog kršenja principa kojih se on sam drži po cijenu propasti.;1;1;1;1
;;XXII;Bez problema je, primjerice, na kraju godine srušio sina bogatog senatora koji je jedan od najvećih donatora škole.;1;1;1;1
;;XXIII;Kada takvog - nabrušenog, mrzovoljnog i neugodnog Paula - za božićne praznike dopadne dužnost da nadgleda petoro učenika koji ne idu kući obiteljima (to su oni koji se u internatima nazivaju the holdovers), čini se kao da će svima ti praznici biti mučenje.;1;1;1;1
;;XXIV;I klinci koji su ostali Paulu na brigu su, razumljivo, loše raspoloženi.;1;1;1;1
;;XXV;Neki od njih su i inače problematični, kao izvjesni Teddy Kountze, pomalo nasilan i tup delinkvent, koji vjeruje roditeljima da ne može doći kući jer se kuća preuređuje i hrpa je stvari uskladištena u njegovoj sobi.;1;1;1;1
;;XXVI;Jedan je sportaška dobričina, koji nije otišao na skijanje s familijom jer je s ocem u natezanju oko toga što ima dugu kosu, jedan je iz Koreje pa mu je predaleko putovati, a jednom su roditelji mormonski misionari i trenutačno su u Južnoj Americi.;1;1;1;1
;;XXVII;No svi pobrojani spletom okolnosti ipak odu iz škole za blagdane.;1;1;1;1
;;XXVIII;Paul ostaje sam u školi s pametnim Angusom Tullyjem i sa školskom kuharicom Mary Lamb.;1;1;1;1
;;XXIX;Giammattijevu kompleksnom liku tako se dodaju još dva kompleksna i zanimljiva lika, iz čije osobne drame i karakteristka proizlazi ostatak filma.;1;1;1;1
;;XXX;Fantastičan mladi glumac Dominic Sessa glumi pametnog mladića Angusa Tullyja, koji je užasno nesretan zbog toga što je trebao otići s majkom i očuhom na Karibe, ali mu je majka to u zadnji trenutak otkazala.;0;0;0;0
;;XXXI;Iako se to čini kao kvazidrama razmaženog bogataškog derišta, vrlo brzo saznajemo da se iza Angusove tuge i povrijeđenosti krije bolna tajna.;1;1;1;1
;;XXXII;Mary Lamb u savršenoj, fantastično kontroliranoj interpretaciji Da'Vine Joy Randolph, koja je za tu izvedbu ove godine osvojila i Oscara, još je jedan kompleksan, tužan, izgubljen lik u ovom filmu.;0;0;0;0
;;XXXIII;Glavna kuharica u školskoj menzi taj je posao svojedobno bila prihvatila kako bi pod posebnim uvjetima i sa stipendijom u elitni Barton mogla upisati svojeg pametnog sina Curtisa.;1;1;1;1
;;XXXIV;Curtis je uspješno maturirao na Bartonu, ali zbog toga što nisu imali novca da ga odmah upišu na Harvard ili Yale, Curtisa su poslali u Vijetnam, gdje je poginuo.;1;1;1;1
;;XXXV;Da'Vine Joy Randolph ožalošćenu majku igra s nevjerojatnom suptilnošću, kao da se pomalo utapa.;0;0;1;0
;;XXXVI;I sad - znam što ćete pomisliti.;1;1;1;1
;;XXXVII;Da, da, da - još jedan božićni film u kojima se nesretni, mrzovoljni, izgubljeni ljudi zbliže, srca im se otope i svima zavlada duh Božića.;1;1;1;1
;;XXXVIII;Već stoput viđeno, od 'Divnog života' do 'Scroogeda' s Billom Murrayjem.;1;1;1;1
;;XXXIX;No vjerujte, nije tako jednostavno ni površno.;1;1;1;1
;;XL;Jest, ovo je topao, božićni film koji će sigurno ući u božićni kanon i vjerojatno se prikazivati o blagdanima.;0;0;0;0
;;XLI;No u njemu je previše slojeva - od osobno-emotivnih do onih društvenih, ilustrativnih za Ameriku nixonovske ere, kada su cvjetići hipijevskog pokreta ocvali, a pred očima se razvila žućkasto-smeđa, otužna stvarnost.;1;1;1;1
;;XLII;Ovo nije još jedan božićni film.;1;1;1;1
;;XLIII;Ovo je emotivna, duhovita, potresna i dirljiva drama u ruhu božićnog filma.;0;0;0;0
19;A;I;Znate, kad sam pročitao kratki sinopsis i vidio poster (namjerno nisam gledao trailer jer sam se brinuo da bi mogao otkriti previše), mislio sam da će ovo biti film u kojem lik Millie Bobby Brown kreće na putovanje, zarobljen u obilju opasnih situacija i borbe protiv mnogih neprijatelja.;1;1;1;1
;;II;Ispostavilo se da je drugačije od mojih očekivanja.;1;1;1;1
;;III;Da, postojala je opasnost u kojoj je bila, ali nije bila onakva kakvu sam zamišljao.;1;1;1;1
;;IV;Zapravo mi se sviđa ova priča jer je bila jedinstvena za bajku.;0;0;0;0
;;V;Za razliku od drugih tipova sličnih priča u kojima je ženski lik obično bio taj koji se spašavao (otuda i izraz “djevojka u nevolji”), ova je bila suprotnost jer se morala spašavati sama.;1;1;1;1
;;VI;Ali bio sam pomalo nesretan što je gotovo cijeli napeti dio filma snimljen u mraku, što baš i nije bilo ugodno gledati.;2;2;2;2
;;VII;Osim toga, bilo je toliko vrištanja uključeno što je bilo razumljivo, iako za mene osobno malo previše.;2;2;2;2
;;VIII;Film je režirao Juan Carlos Fresnadillo (28 Weeks Later, Intruders itd.), a scenarij je napisao Dan Mazeau (Wrath of the Titans, Fast X).;1;1;1;1
;;IX;Koliko sam pročitao, Mazeauov scenarij iskoristila je Evelyn Skye za pisanje vlastitog romana koji je objavljen prije nego što je film objavljen.;1;1;1;1
;;X;Znači li to da je film temeljen na romanu ili obrnuto?;1;1;1;1
;;XI;Uglavnom, kao što rekoh, mislim da je ova bajka s pomakom pametna i zanimljiva.;0;0;0;0
;;XII;Glumačka postava bila je prilično pristojna s Millie Bobby Brown koja je očito bila zvijezda filma.;0;0;0;0
;;XIII;Mislim da je Robin Wright bila prilično uvjerljiva u svojoj ulozi zbog koje sam bio zadovoljan završetkom, ali smatrao sam da Angela Basset nije imala dovoljno vremena na ekranu da pokaže svoje sposobnosti.;2;1;1;1
;;XIV;Akcija nije bila loša i bilo je tu i tamo neizvjesnosti.;0;0;0;0
;;XV;To jednostavno nije dovoljno da zadovolji moj apetit za još avanture.;2;2;2;2
;;XVI;Ali zmaj mi se dopao i mislim da je karakterizacija glasa prilično briljantna.;0;0;0;0
;;XVII;To je vjerojatno slično mom osjećaju kada čujem Seana Conneryja kako daje glas Dracu u popularnom filmu Dragonheart iz 1996.;1;1;1;1
;;XVIII;Sve u svemu, ovo je još uvijek bio dovoljno dobar film mračne fantazije s jedinstvenom pričom i nekim zabavnim trenucima.;0;0;0;0
;;XIX;Intenzitet je bio OK, ali je bilo previše mračnih scena i glasnog vrištanja.;2;2;2;2
;;XX;Trajao je 110 minuta, što je uključivalo duge odjavne špice bez odjavnih scena na sredini/na kraju.;1;1;1;1
;;XXI;Dakle, ako ste zainteresirani za gledanje različitih vrsta bajki, onda bi se ovo trebalo uklopiti u kategoriju.;1;1;1;1
;;XXII;Ali ako ste poput mene i očekujete zabavnu avanturističku vrstu filma, onda vas ovo ne bi baš zadovoljilo.;2;2;2;2
;B;I;Film Dama je bajkovita fantazija s jakim glumačkim imenima.;0;0;0;0
;;II;No, u konačnici redatelj Juan Carlos Fresnadillo nije iskoristio sav potencijal priče pa je riječ tek o slabašnom filmu.;2;2;2;2
;;III;Priča filma vodi nas kroz avanturu mlade plemkinje Elodie.;1;1;1;1
;;IV;Kraljevstvo njezinog oca je u velikim problemima pa je jedini izlaz njezina udaja za s princa Henryja, nasljednikom kraljevstva Auree u kojem (sasvim očito) glavnu riječ vodi zla kraljica Isabelle.;1;1;1;1
;;V;Elodie misli da se udaje za savršenog princa no ubrzo shvaća da od toga neće biti ništa.;1;1;1;1
;;VI;Biva bačena u jamu kao žrtva koja treba umiriti krvoločnog zmaja.;1;1;1;1
;;VII;Prvi napad zmaja preživljava te uskoro shvaća da ju nitko neće spasiti i da je u potpunosti prepuštena samoj sebi.;1;1;1;1
;;VIII;Odlučuje se na pokušaj bijega koji je sve samo ne jednostavan.;1;1;1;1
;;XI;Sam film mogao bi se okarakterizirati i bajkom (svi elementi su tu).;1;1;1;1
;;XII;No, ima jednu razliku koja se već u startu filma naglašava: “Postoje mnoge priče o viteštvu u kojima herojski vitez spašava damu u nevolji.;1;1;1;1
;;XIII;Ovo nije jedna od njih”.;1;1;1;1
;;XIV;I, doista, ovaj film nije jedna od tih bajki.;1;1;1;1
;;XV;Film redatelja Juana Carlosa Fresnadilloa (pamtimo ga po i više nego dobrom hororcu 28 tjedana kasnije/28 Weeks Later, 2007.).;1;0;0;0
;;XVI;On otvara film vrlo obećavajuće, sa skupinom vitezova koji se spuštaju u pećinu i sukobljavaju s opakim zmajem.;0;0;0;0
;;XVII;No, taj zmaj je tu još podosta skriven a uvodna priča ostaje zagonetna.;1;1;1;1
;;XVIII;Ono što slijedi je bajkovito Elodieino putovanje u bogato kraljevstvo i događaji koji slijede iz priče filma.;1;1;1;1
;;XIX;Ono što odmah upada u oči je mala neobičnost prostora u kojem se odvija radnja filma.;1;1;1;1
;;XX;Naime, prikaz kraljevstva scenografski je vrlo dobro odrađen, sve je šareno i veliko.;0;0;0;0
;;XXI;Međutim, taj dio je relativno kratak i film nas dalje vodi u crnu pećinu.;1;1;1;1
;;XXII;Dakle, vizualno u totalnu suprotnost, iz boja u crni mrak.;1;2;2;2
;;XXIII;Scenografski to sve izgleda kao da se uvelike štedjelo na produkciji.;1;2;2;2
;;XXIV;Pokoji labirint, pokoja zamka u obliku ponora i oštrih stijena, neobični svjetleći kukci-žitelji pećine i uglavnom mrak u kojem se skriva opaki zmaj.;1;1;1;1
;;XXV;Sve to asocira na neki prostor koji je već viđen, npr. u serijalu Alien filmova.;1;1;2;1
;;XXVI;Najveća mana filma, uz predvidljivost priče i sporu radnju, je nedostatak uzbuđenja i napetosti.;2;2;2;2
;;XXVII;Glavna junakinja je u svojoj avanturi stavljena je pred mnoštvo izazovnih situacija.;1;1;1;1
;;XXVIII;Neke od njih su i pogubne za njezin život.;1;1;1;1
;;XXIX;No, sve što redatelj uspije izazvati je tek pokušaj da se stvori neka napeta situacija.;2;2;2;2
;;XXX;U svim tim scenama, ma koliko god da se mlada Millie Bobby Brown trudila biti uvjerljiva, sve to je prilično mlako te ostaje na razini pokušaja bez pravog efekta po gledatelja.;2;2;2;2
;;XXXI;Teško je reći u čemu je tu problem jer Fresnadillo se već potvrdio kao talentirani redatelj.;1;1;1;1
;;XXXII;U filmu koristi dosta efekata pa možda i tu leži dio problema.;2;2;2;2
;;XXXIII;Sve u svemu, čini se da čitav produkcijski tim nije uspio ovladati ni mrakom kao elementom za izazivanje straha i nelagode.;2;2;2;2
;;XXXIV;Sve u svemu, film Dama slabašan je pokušaj svojevrsnog ženskog survival – die hard filma.;2;2;2;2
;;XXXV;Velika šteta, jer u sebi sadržava potencijal za puno više od ovoga.;0;2;1;
;;XXXVI;Film je dostupan na platformi Netflix.;1;1;1;1
;C;I;"Jedva sam čekala novi film na Netflixu u kojem glavnu ulogu ima Millie Bobby Brown, mlada glumica koja nas je kupila u megapopularnoj teen-seriji ""Stranger Things"" kao čudnovata djevojčica Eleven.";1;0;0;0
;;II;Brown igra atipičnu princezu koja već u startu kao pripovjedačica nagovijesti da ono što gledamo neće biti priča o tome kako je princ spasio svoju princezu.;1;1;1;1
;;III;"Kako je rekla, tako je i bilo, a film ""Dama"" solidna je razbibriga koja me iznenadila svojom mračnom estetikom koju zaista nisam očekivala.";0;0;0;0
;;V;"Zanimljivo je da su film čiju tematiku možemo okarakterizirati kao blagi feminizam prekriven žanrom fantazije napisala i režirala dva muškarca, ali to je manje bitno kada govorimo o ""Dami"".";1;1;1;1
;;VI;Baš kao i bilo koja druga bajka koju smo čitali kao djeca, ovaj film banalno nagovijesti što će se dogoditi.;1;1;1;1
;;VII;Dvadeset minuta gledanja dovoljno je da nam bude jasno da će kraj biti sretan i da je vrlo vjerojatno da princeza neće živjeti sretno do kraja života u prekrasnom kraljevstvu obasutom cvijećem.;1;1;1;1
;;VIII;Ono što nikako ne možemo znati kao gledatelji, a što je ujedno i glavni zaplet, jest da će se bajka brzo pretvoriti u noćnu moru.;1;1;1;1
;;IX;Doista me iznenadilo koliko je film vizualno mračan i na trenutke strašan do mjere da zaboravim prekrasnu kulisu s početka.;1;1;1;1
;;X;Mazeau nije ostavio previše iznenađenja u scenariju te sam mišljenja da bi veći wow efekt postigao kada nam ne bi otkrio na početku apsolutno sve.;2;2;2;2
;;XI;Unatoč tomu, također postoji neka satisfakcija u gledanju princeze kako se bori sa strašnom zmajicom dok u podsvijesti znamo da će izići iz duboke špilje sa samo nekoliko ogrebotina.;0;0;0;0
;;XII;Juan Carlos Fresnadillo režijski je ovaj film učinio jednako kristalno jasnim, ali i jednako predvidljivim.;2;2;2;2
;;XIII;"""Dama"" je film o nesvakidašnjoj princezi koja je doslovno bačena na dno kako bi sama shvatila koliko je važno biti snalažljiv i neovisan kako bi preživio u izvanrednim okolnostima.";1;1;1;1
;;XIV;Millie Bobby Brown utjelovljuje lik Princeze Elodie, mlade žene koja je spremna na brak s nepoznatim mladim muškarcem kako bi spasila svoje kraljevstvo.;1;1;1;1
;;XV;Iako je Bobby Brown već izrasla u mladu ženu, ona se i dalja smatra dječjom glumicom u Hollywoodu.;1;1;1;1
;;XVI;Uloga princeze Elodie ne zahtijeva preveliku glumačku širinu te moram priznati da se Bobby Brown ne snalazi najbolje u ovom filmu.;2;2;2;2
;;XVII;Najbolje se snalazi u trenutcima kada pokazuje svoje fizičke sposobnosti u akcijskim scenama, dok u emotivnim promjenama zaista vidimo još uvijek neiskusnu mladu glumicu koja je tek zagrebala površinu glumačkog zanata.;2;2;2;2
;;XVIII;Bobby Brown nedvojbeno je simpatična i kao gledatelji lako se vežemo za njezin lik, ali moram priznati da me u nekoliko navrata poprilično iznervirao način na koji verbalno pokazuje nezadovoljstvo svojeg lika.;2;2;2;2
;;XIX;Angela Bassett i Robin Wright dvije su vrsne glumice koje također igraju uz Millie te svoje likove igraju odlično.;0;0;0;0
