Sentence,Label
"Naime, ta uznemirujuća želja da budeš slavan i činjenica kako su neki ljudi spremni učiniti sve samo da bi došli do cilja, upravo je kroz Pearl itekako realno prikazana.",0
"Film bi se mogao činiti kao vječnost, bez obzira na malu minutažu, da kojim slučajem glumačka ekipa nije bila u potpunosti pogođena.",1
"Ono što razlikuje Nosferatu od njegovih prethodnika u prvom je redu seksualna veza, i to u psihološkom smislu, između Ellen i Orloka, gdje kod Ellen posebno dolazi do izražaja neka vrsta vanzemaljske prirode.",1
"Njih su zasluženo dobili Michelle Yeoh za glavnu žensku ulogu, Stephanie Hsu i Jamie Lee Curtis za sporedne ženske uloge te Ke Huy Quan za sporednu mušku ulogu.",1
"No, ako bolje promislite, tako nešto uopće nije niti potrebno.",1
To je uistinu lijep poetski motiv kroz paralizu sna.,0
A uz to ih i spojiti ih s nevjerojatno lijepim i epskim vizualnim scenama.,0
"Ali to nije bitno, zato što su Danijeli posebni.",1
Mi kao gledatelji postajemo trinaesti član porote odmah uvučeni u teoretiziranje o boljoj verziji pravde.,1
"Ako je Mohan već htio preuzeti nešto iz Conjuring franšize, to je svakako trebala biti dublja razrada likova kojih ovdje kronično nedostaje.",1
"Studio ga nije â€˜pomladioâ€™, pa je malo teško povjerovati da je radnja filma zapravo smještena između prvog i drugog dijela serijala.",2
"Film, dakle, uspješno balansira između tenzije trilera, satirične komedije i horora.",0
"No to ne znači da je baš uvijek bilo tako, jer je u nekim trenucima, zahvaljujući njihovim izvedbama i uzimajući u obzir materijal kojim su morali žonglirati, to djelovalo poprilično zadovoljavajuće.",0
"Redatelj , većinom, sve do finala filma nepristran i vrlo efektno rekonstruira biranje prvog čovjeka Katoličke crkve.",2
"No, koliko god ta slika bila promijenjena mislim da će Crkva kao i politika opstati jer uvijek će doći netko drugi na vlast, uvijek će se naći netko bolji za našu budućnost, a koji je zapravo isti kao i svaki prethodni političar.",1
"I dok se u romanu Mina Harker, tako se zvao glavni ženski lik za vas koji možda niste čitali, više oslanja na muškarce, Eggers je od Ellen napravio junakinju čija je žrtva vodi uništenju, pogotovo kada postane svjesna neizbježnosti situacije u kojoj se nalazi.",1
"Buckley u glavnoj ulozi definitivno nosi teret ovog filma, bez obzira što se Rory Kinnear pojavljuje u višestrukim ulogama.",0
"Kroz jednu rečenicu postaje nam jasno kako u filmu nećemo gledati tipičnog ubojicu, odnosno akciju u stilu Johna Wicka koji će jašući konja pobiti pola grada.",1
Horor.,1
"Jer, da su se kojim slučajem našli u konkurenciji u bilo kojoj kategoriji, posebice kada su u pitanju one tehničke, imali bi manje šanse nego Lloyd prema Marry u filmu ""Glup i Gluplji"".",0
"Određeni delovi priče se odvijaju kao melanholične montaže na podeljenom ekranu, a svakako najznačajiju promenu tona predstavlja neočekivano dirljiva i prilično odbojna scena između ostarelog bračnog para koja ubrzo postaje gruba komedija.",1
"Mi smo u tom pogledu poput detektiva te pratimo tragove koji nam se na prvi pogled neće činiti toliko važnim, ali koji će s klimaksom postati itekako bitni za konačno kompletiranje slagalice.",1
"Nema problema, uvijek za alternativu imate neko putovanje na izolirani otok i degustiranje elitnih jela u eksluzivnim restoranima.",1
"Takvo ozračje Peele ipak često prekida duhovitim dijalogom i humorističnim epizodama i vrckavim vizualima, da bi u završnoj fazi svoj film pretvorio u maksimalistički spektakl svojstven pustolovnim B-filmovima osamdesetih.",0
"Ali kako to obično biva, svaki film ima jače i slabije aspekte. Što se tiče ""Ubojice"", jača strana se definitivno nalazi u akciji koja nakon sporog početka napokon dopušta da film prodiše.",1
"Sve to djeluje i na sam klimaks filma, a koji nas nagrađuje za strpljenje upravo dobrim starim slasher momentima.",0
"Derrickson, međutim, nije mirovao, već je pauzu od snimanja filmova iskoristio za stvaranje novog, originalnog filma, na koji će staviti svoj prepoznatljivi pečat. ",1
"Svi su oni plitki ljudi, što je ujedno i poenta koja nije previše pronicljiva.",1
"Ne samo da ne pokazuje pretjerani interes za ubojičine motive, već koristi slike prirode kroz koje stvara našu veću povezanost sa žrtvama od trenutka kada ih upoznajemo.",1
"Osim već spomenute suptilnosti kroz koju jedva da pokazuje emocije, on diše neku vrstu melankolije prošlog vremena.",1
Ti kadrovi borbe uistinu su bili nešto posebno upravo zato što su ukomponirani u širi kontekst filma.,0
"I budite realni, da vam je netko rekao da ćete u bilo kojem ""Saw"" filmu gledati emocionalno putovanje glavnog negativca, umjesto kaos i klanje sa stajališta žrtava, da li biste mu povjerovali?",1
"Razlozi zbog kojih je odabrao baš ovu turu gostiju za smaknuće, kao i razlozi osoblja da ga slijede u smrt ostaju površni.",1
"Dakle, imamo predstavljanje određenog lika, nakon čega slijedi uljudan Jigsaw pozdrav i na kraju odbrojavanje kroz igru ""živi ili umri"".",1
I dalje niste sigurni u odluku.,1
"Eggersov film djeluje poput stvaranja mitologije folklora o transilvanijskim vampirima koji je u skladu s okultnim, i to iz perspektive glavne protagonistice, a što je bitna razlika u odnosu na sve prethodne filmove, a koji su započinjali priču s Jonathanom Harkerom inače glavnim likom iz Stokerovog romana, dok bi tek kasnije Ellen došla u fokus.",1
"Cooper je duže vrijeme u planu imao realizaciju istoimenog književnog predloška američkog pisca Louisa Bayarda, ali je početak snimanja, iz različitih razloga, nekoliko puta bio odgođen.",1
"Za one koji nisu gledali originalnu verziju, obitelj ode na odmor u Italiju i tamo sretnu drugu obitelj s kojima se sprijatelje.",1
"Ako je Cooperu tim zaključkom namjera bila uspostaviti takozvani red herring, odnosno zavesti gledatelje pomoću krivoga traga, onda to zacijelo ovdje ostaje promašen narativni postupak.",1
Sve to tjera ga na internacionalni lov na one koji su mu učinili zlo.,1
Kakvi su utisci nakon gledanja novog filma?,1
"Michelle Yeoh prenaglasila je lik kojeg interpretira, Tina Fey uvjerljivo dvolična vrlo dobar je i+ Jude Hill u ulozi dječaka Leopolda koji je ključan za čitav slučaj odnosno priču filma.",0
"Mješavina ljepote i užasa u onom vizualnom smislu prati i sama radnja filma, iako moram priznat kako bi mi bilo draže da je redatelj uz formiranje metafore i svega onoga što ona nama znači, još veći fokus stavio na samu priču.",1
"Naime, pogotovo na početku filma, dobivamo nekoliko scena u kojima je CGI vrlo očit.",2
"Film je ""Vještica"" koji je bio glumački prvijenac Anye Taylor-Joy koja je do danas, nešto manje od desetljeće nakon ""Vještice"" u 28. godini nanizala više vrlo dobrih i odličnih nastupa na filmu i serijama (Furiosa, Posljednja noć u Sohou, Damin gambit, Peaky Blinders.).",0
"No, budimo realni, koga to zapravo previše zanima.",2
"Upravo to je bio motiv koji se stalno provlačio kroz film, odnosno slika zla koji nosi osmijeh kako bi ostvarilo prijetnju.",0
"Film stoji kao preporuka svima koji vole nešto opskurniji smisao za humor, akcijski triler ili tek jednostavno vole uživati u hrani.",1
I sama akcija kao i vizualni identitet filma u potpunosti se uklapaju u svijet kojeg smo vidjeli u prethodnom filmu.,0
"To je prvenstveno briljanta Millerova vizija, brutalna scenografija s nevjerojatnim vozilima, ikonična postapokaliptična kostimografija, sjajan zvuk i montaža. uglavnom sve one stvari za koje je prethodnik osvojio Oscare i to je gotovo dovoljno da bi ga se proglasilo izvrsnim.",0
"Michael Fassbender glumi bezimenog plaćenog ubojicu kojeg nakon neuspješno obavljenog posla, budući da u toj branši očito nema povrata novca, proganjaju nezadovoljni poslodavaci, te će lovac ubrzo postati lovina, da bi zatim još brže ponovno postao lovac putujući po svijetu, nabijajući kilometražu koje se ne bi posramio ni James Bond, susrećući odreda dubiozne karaktere koje treba što brže i efikasnije eliminirati.",1
"Nažalost, to često nije slučaj s prequelima, ali Miller je posao odradio baš kako treba.",0
Finnes kao kardinal Lawrence zanimljiv je lik.,1
"Toga ovdje nema, već je svaki jump scare dio priče, i jednako je dojmljiv, što kao posljedicu stvara uvjerljiv dojam za scene koje smo prethodno vidjeli i u samoj najavi filma.",1
"Michael Fassbender, kojem nikad ne saznamo ime, je plaćeni ubojica koji je unajmljen da ubije klijenta u Parizu.",1
"Rezultirajući horor u kome dete nanosi sebi povrede pod uticajem natprirodnog bića je prilično zastrašujuć, što je veliki uspeh nakon decenija sličnih scena u drugim filmovima.",0
"Jer on joj ne može dati život koji ona želi, dok je njegova ideja savršenog života jednostavno. život s njom.",1
Ili savršeno po muškom načinu razmišljanja.,1
"Ti West je svakako jedan od onih redatelja koji diše horor žanr, a to je s ovom filmom itekako pokazao.",0
Saw X je definitivno osvježenje za ovu kultnu horor franšizu.,0
"""Dune: Part Two"" je film u kojem i obično hodanje na pijesku djeluje poetično.",0
"U međuvremenu, u Vatikanu se događa i teroristički napad koji se prvo pokušava zatajiti kardinalima, jer nitko iz vanjskog svijeta ne smije utjecati na njihov izbor, no to im baš ne ide kako treba.",1
Inicijalna kapisla za nasilje je kombinacija zavisti farmerove žene prema mladim devojkama i njene seksualne frustracije jer je suprug više ne može zadovoljiti.,1
"Ovaj proces, također poznat kao konklava, predvodit će kardinal Thomas Lawrence (Ralph Fiennes) čovjek koji, suočen s krizom vjere, već neko vrijeme uzaludno sniva o odstupanju s dužnosti.",1
"Odgovor leži u smještanju ovog osvrta u našu rubriku ""3,6 rendgena"" u kojoj filmove ocjenjujemo kao one koji pripadaju kategoriji ""not great, not terrible."" Ako imate želuca za takve stvari, možda je u pitanju jedan od rijetkih nastavaka franšize koji nisu doista loši, pa ga stoga ne treba izbjegavati.",1
Women of the Hour tako postaje dobro strukturirani triler koji se uspješno bavi složenijim i bitnim temama.,0
Tobin Bell je bez ikakve dileme odigrao najbolju ulogu kada je u pitanju serijal.,0
"Kada je god suočen s problemom, Henk pričeka pred zgradom i ušulja se unatoč odbijenici ili slijedi osobu s kojom je želio razgovarati po izlasku.",1
"Kao što sam već prethodno napisao, film ima odličnu i zanimljivu ideju, baziranu na grafičkom romanu Sandcastle po kojem je Shyamalan i napisao adaptirani scenarij.",0
"U tom je pogledu također drugačiji od prethodnika, jer se više oslanja na šok moment, a manje na humor.",1
"Iz tog razloga zanimao me triler Konklava (Conclave, 2024).",0
"Film vizualno ima štih 80-ih i 90-ih, a koji opet izražava notu po kojoj ""svira"" film i njihovi likovi.",0
"Iako moram priznati kako me na trenutak podsjetio na Voldemorta koji se nakon pobjede u ""Večeri za pet"" odlučio na vođenje vlastitog restorana.",1
"Dok mi moramo egzotično tražiti van europskog kontinenta, Nijemcima je bilo dovoljno već pogledati na Balkan.",1
"U Hrvatskoj pravosuđe doživljavamo sve češće nepravednim zbog korupcije, pogodovanja i postavljanja sudaca i odvjetnika po plemenskom principu.",2
Ili barem tako sama misli.,1
"Ako je sve dosad i bilo donekle realistično, finale je ipak puka beletristika.",1
U tom smislu uvod samog filma je i više nego simboličan.,0
"Svi su muškarci isti, ali postoje žene koje to ne shvaćaju.",1
"Pa ipak, on to radi, posebice kada se nakon toga čuje ""Da, Chefe!"" Taj osjećaj kulta, stvara popriličnu neugodu, a koja se pojačava sa svakim novim pljeskom.",1
"Ona se neće libiti pokazati impulzivnost, što odgovara slojevitosti njenog karaktera.",1
"""Donâ€™t Worry Darling"" u režijskom smislu je magnetsko hipnotičan film.",1
Traume nasilja u obitelji kao i nasilja koje se događalo u njegovom susjedstvu te vrijeme serijskih ubojica koji su terorizirali Ameriku u vremenu Derricksonova odrastanja.,1
"Old je film koji sa različitim efektom balansira između obiteljske drame, misterije i trilera.",1
"Da, netko će reći, likovi jesu čudni jer sama situacija u kojoj se nalaze je upravo takva.",2
"Ne može se poreći da ovaj film ipak jest, u konačnici, unikatno iskustvo, a to je ono što i jest najvažnije kod ovakve složene tematike.",0
"Veliki doprinos rastu ""nezavisnog filma"" imao je početkom 90-ih Quentin Tarantino, i to s kultnim ""Psima iz rezervoara"".",0
"Jer način na koji su nam predstavljeni likovi, počevši od mladog para Tylera (Nicholas Hoult) i Margot (Anya Taylor-Joy), preko neimenovane filmske zvijezde (John Leguizamo), gastronomke kritičarke Lillian (Janet McTeer) i njenog urednika Teda (Paul Adelstein), bogatih financijera i bračnih parova, pa sve do glavne zvijezde filma i kuhinje Chefa Slowika (Ralph Fiennes), definitivno podsjeća na Altmanov stil režije, ponajviše na njegovo remek djelo Gosford Park.",0
"U svakom trenutku Eggers želi (i većinom uspijeva) fotografiju odnosno izgled filma spojiti s pričom doživljaj i izgled scena nisu samo ukras već često sudjeluju u radnji, sugeriraju odnosno produbljuju značenje scena i postupaka protagonista te su dio u njihovih karakterizacija (uz jezive igre svjetla i sjene, mraka i nade) Upravo fotografija, izgled filma te scenografija i kostimografija su najsnažniji adut filma, ali i razlog za gledanje ""Nosferatua"" na velikom platnu.",0
"Spomenuo sam kako film postaje jeziv i prije nego što krene taj krvavi pir, što jako dobro djeluje na stvaranje tenzija između svih tih brutalnih scena.",0
"Ipak, Oliver je i patetičan jer očigledno očajnički želi da se uklopi ne među studente nego u odabranu aristokratsku grupu studenata.",1
Nju ćemo gledati više u trećem nastavku Dune: Messiah.,1
"Pa ipak, film također ima i jako puno pozitivnih strana, što ga čini vrijednim gledanja.",0
Već u prvom dijelu filma jasno je da The Substance nema namjeru svoju poruku iznijeti na suptilan način.,1
"Kad odjednom, usred vašeg izlaganja, prijatelj vas prekine, ali ne da bi vam kontrirao, nego da bi vam rekao kako je sin Maje Šuput pojeo svoj prvi sendvič.",2
"Jedan od njih je inspirirao film ""Woman of the Hour"", a dogodio se 13. rujna 1978. godine kada se u popularnoj igri za spajanje parova, ""The Dating Game"", pojavio natjecatelj pod imenom Rodney Alcala",1
"Ovo je, inače, njegov debitantski film, tako da uistinu zaslužuje sve pohvale, prije svega jer se i sam film u velikoj mjeri oslanja upravo na njegovu izvedbu.",1
Miller nam tako daje dosta vremena da se upoznamo s Furiosinom pričom još od njenog djetinjstva.,1
"Film nastavlja u sličnom tonu, iako ne ponavlja toliku razinu fantazmagorije.",1
"Film mu pri tome daje šansu za iskupljenje, posebice u završnici, tako da nisam nikako mogao imati bilo kakve simpatije prema njemu.",2
"Na taj način ona prikazuje svu tu bujicu emocija koje, paradoksa radi, upravo i želi sakriti ali joj to ne polazi za sjekirom, pardon rukom.",1
"U tom smislu nam, baš poput nekog teasera, kroz neke dijelove filma daje naznaku kako bi taj treći dio ove sage mogao izgledati.",1
"Dakle, glavni aperitiv ovog filma definitivno su eksterijeri i interijeri kroz koje nas glavna Chefova pomoćnica Elsa ( jezivo zastrašujuća Hong Chau) upoznaje u onom psihološkom smislu s načinom pripreme hrane, što je zapravo odlična metafora za mjesto gdje ćemo kasnije provesti najviše vremena.",0
"Istina, ona je psihotična, ali im nitko ne može oduzet činjenicu kako su upravo oni najnapredniji, a što stvara ubitačnu kombinaciju.",0
"Meni je, primjerice, bilo jako zanimljivo vidjeti na koji način mi osjećamo njene emocije, posebice kad se treba suočiti s nekim teškim životnim odlukama.",0
Tko profitira?,1
Ovdje gledamo njegov (zamišljeni) nastanak.,0
"Već na urnebesan, zabavan način, ako, jasno, niste alergični na ogromne količine umjetne krvi koja ovdje teče u potocima i sulude i groteskne tjelesne transformacije.",1
"Mnogi obožavatelji serijala o arheologu Indiani Jonesu, vjerojatno su mogli primijetiti da glumac koji glumi Evelyninog muža Waymonga jest ni više ni manje nego dječak Short Round iz drugog nastavka filma naziva ""Indiana Jones i ukleti hram"" (1984).",0
"Eto, tako su otprilike u velikoj većini slučajeva izgledali dijalozi u filmu.",1
"Iako sam lošiji prognozer i od Ćire Blaževića, ove sam izbore predvidio lakše i od pobjede Trumpa nad Kamalom, i to već nakon drugog kruga glasanja, pa nije pogrešno govoriti o dramaturškoj predvidljivosti i prvoloptaškim rješenjima za kojima bi vjerojatno posegnuo i dramaturg kakve telenovele.",0
"Osim što samom pričom zadire u Herbertov svijet, upoznaje nas još intimnije s likovima koje smo imali priliku samo na kratko vidjeti u prvom filmu.",1
U sobi leži starac.,1
"Na kraju ""Nope"" sa svim tim elementima (uz efektnu popratnu fabulu o Jupeovoj tragediji koja uključuje čimpanzu ubojicu, ali koja nažalost ne vodi nigdje) djeluje kao film koji u svakom od žanrova koje pokriva dobacuje do određene točke, ali ni u jednom to ne čini do kraja.",1
"Balans između režije i scenarija, koji je Derrickson pisao zajedno s Robertom Cargillom, tada u potpunosti dolazi do izražaja.",1
Inače nisam ljubitelj horora.,1
"No, Branagh i njegov Poirot idu dalje stigao je i treći slučaj pod naslovom ""Ubojstvo u Veneciji"".",1
Alice izuva svoje salonke i prkosno sjeda na čelo stola.,1
Ubojičina maska (kao i čitava pojava) impresivno je stravična interakcija između ubojice i otetog te za ubojstvo određenog Finneyja hororski izvrsno funkcionira.,1
"U tom pogledu i funkcionira The Killer, kao žanrovski film bez ikakve pozadinske priče, gdje osjećamo dovoljno jake vibracije, i to kroz tišinu glavnog lika koji može bilo kojeg trenutka eksplodirati.",0
Tema ove priče zapravo je otuđenost jedne obitelji.,1
"U konačnici, riječ je o tipičnom ljenivcu koji je odustao od vlastitog života umjesto da se trgne iz sna i počne se boriti za sebe i svoju okolinu.",1
"Kako na marginama filma, tako i na marginama radnje.",1
"Razlog leži u tome što je film producirao Netflix, a što u prijevodu znači limitiranu kino distribuciju koja gotovo uvijek zaobilazi naša kina.",2
"Film je znatno bolje prošao kod publike nego kod kritike (intrigantna glumačka ekipa predvođena sestrom Dextera Morgana Jennifer Carpenter jedan je od glavnih aduta filma) i Derrickson je počeo graditi karijeru koja, većinom, ima snažan hororski pečat.",1
"Najviše treba pohvaliti Ralpha Fiennesa i Johna Lithgowa koji glume kardinale Lawrencea i Tremblaya, a koji tumače odgovorne likove, utjecajne i cijenjene u konklavi, koji pršte smirenošću (kako glasom, tako i stasom) i ozbiljnosti iako u nekoliko navrata pucaju po šavovima kako i sam tijek izbora puca po šavovima.",1
"Također, izbor mjesta gdje se žrtve bore za preživljavanje također savršeno odgovaraju toj srednjovjekovnoj mitologiji.",0
"Dojmljiv, jeziv ugođaj gradića ispunjenog tajnama i opterećenog nasiljem opipljiv je od prvih trenutaka filma.",1
"Naime, Houltov lik je pretenciozni snob koji zna sve o hrani, te vješto barata svom mogućom terminologijom.",1
"Naravno, nije on bio jedini koji je uspješno skinuo ""redateljsku nevinost"".",1
Jedna od rijetkih manjih zamjerki koje imam za Dune 2 je što se određene promjene kod Paula u drugom dijelu filma predstavljene u vrlo kratkom vremenskom roku i nisu dovoljno razrađene.,2
"Za razliku od svog prethodnika, ovaj se film više fokusirao na akciju nego na dramu.",1
"Glavnu ulogu u filmu tumači Ethan Hawke koji je još jednom pokazao da se radi o iznimno talentiranom glumcu, iako mi se nekako čini kako je dosta podcijenjen i da ne dobiva ni približno toliko priznanja kao što zaslužuje, i to upravo zahvaljujući svojim ulogama.",1
"""Porotnik broj 2"" u tom smislu čitam kao hiperbolu budućnosti omogućenu mentalitetom krda ovaca koje trebaju demagoge da im odlučuju o životima skrojenima prema njihovim osobnim ciljevima u elitnoj mreži koju su spleli.",1
"Zatim, one nešto malo manje tradicionalne, ali opet ekstremne kardinale na čelu s kardinalom Adeyemijem koji je zakleti protivnik homoseksualaca, a tu je i kardinal Tremblay i njegova svita koja je oličenje mita i korupcije.",1
Film Tetris prati Tarona Egertona u ulozi Henka Rogersa kao vrckavog i pomalo prepredenog biznismena s vizijom.,1
"S obzirom na ekipu filma i prethodne uspješne suradnje redatelja Coopera i glumca Christiana Balea očekivanja od ""Blijedoplavog oka"" bila su, opravdano, velika.",1
"Uz spomenute glumce, u filmu se pojavljuje britanska glumačka veteranka Janet McTeer, kao pokvarena i snobistička kritičarka Lillian, Paul Adelstein kao njezin ulizivački urednik, John Leguizamo kao isprani glumac te drugi koji isto tako dobivaju svoj trenutak pod reflektorom.",1
"Nije izvrstan, ali nije ni loš.",1
Onih koji su oduševljeni filmom ili onih koji ne shvaćaju zašto je film tako popularan.,1
"Doista, odmaralište, ali i obiteljska idila tek su gluma, lijepa površina ispod kojih se kriju tajne.",1
"Ovo je art horor koji ne samo da odaje počast nekim kultnim horor klasicima, posebice filmu ""Eaten Alive"" redatelja Tobea Hoopera, i to kroz jednu od najboljih i najnapetijih scena u filmu, već na svoj poseban način ispisuje ljubavno pismo prema samom snimanju i stvaranju filmova.",0
"Anya glumi Margot koju upoznajemo dok puši čekajući brod koji će je povesti na gastronomski izlet kojim predsjeda slavni kuhar Julian Slowik (Ralph Fiennes), a na koji je vodi njezin partner Tyler (Nicholas Hoult) koji je snob i ono što se nekad nazivalo gurmanom, ali se danas u duhu vremena pojmovne ispraznosti označava kao ""foodie"".",1
"Pokušaj kritike engleske aristokratije se poigrava sa idejom o ovim ogromnim bastionima privilegija i moći kao jedinstvenom leglu čudnosti, ali ne pogađa baš u centar.",1
"Izdvaja se Willem Dafoe u ulozi liječničkog ekscentrika, kojemu je ovo već treća suradnja s Eggersom.",1
"Vjerojatno ste primijetili da su svi filmovi s najvećom zaradom ove godine nastavci ili novi izdanci prethodno postojećih franšiza, što svakako podupire tezu o manjku novih ideja u Hollywoodu, ali ukazuje i na to da publika i dalje najviše voli ono što je provjereno i od ranije poznato",1
"Pa ipak, Denis Villeneuve pokazao je kako voli izazove.",1
"Film zaokreće standardnu priču o plaćenim ubojicama, izostavljajući akcijske spektakle, eksplozije, dvostruke, trostruke i četverostruke agente te umjesto toga smješta film u svakodnevicu, svu njegovu monotonu prozaičnost.",1
"Riječ je o novoj drogi na crnom tržištu koja Elizabeth pretvori u mlađu, bolju i privlačniju verziju nje same Sue (Margaret Qualley).",1
"Ako vam je original bio po guštu, vjerujem kako ćete cijeniti ovaj film, upravo zbog tog drugačijeg iskustva gledanja u kojem sam ja, iskreno rečeno, puno više uživao.",0
Vjerujem kako bi se vaši odgovori razlikovali samo u naslovu njegovih filmova koji su vam iz nekog razloga prirasli srcu.,1
"Drugim riječima, 3,6 rendgena.",0
"Gledajući film apsolutno je jasno što se događa u redovima Crkve, a reflektira se i na ostatak svijeta muškarci će učiniti sve da bi došli do vlasti (jer vlast je slast), ženama nije mjesto na visokim pozicijama, štoviše, predodređeno im je da budu sluškinje, bolje izabrati najgoreg bijelca, nego crnca, dakle nema mjesta za ravnopravnost bilo kakve vrste i ono što je najgore od svega nikad se to neće promijeniti dok god je ovog začaranog kruga i dok god, slikovito rečeno, svi imaju prste u pekmezu.",1
"U međuvremenu, njihov američki rođak Farli prepoznaje Oliverove motive da se prikači ovoj porodici uglavnom zato što je i on takav.",1
"Srećom, kako sam već spomenuo, nisam ostao razočaran.",0
"U borbi protiv neimenovanog demona ostat će sasvim sama, a jedinu pomoć pružit će joj njezin bivši partner, policijski detektiv Joel (Kyle Gallner).",0
Od velike crne krafne.,1
"Nakon gledanja ""Bezgrešne"", mogu reći kako je redatelj Michael Mohan previše igrao na sigurno.",1
Saltburn je drugi film redateljice Emerald Fennell koja se 2020. predstavila s filmom Djevojka koja obećava (Promising Young Woman).,1
Hoće li žena izbosti muža zbog nevjere kada će oboje svejedno umrijeti?,1
"Eggersov vrag je u detaljima, i tada doslovno imate osjećaj kao da odlazite u pakao, gdje je Orlokova prisutnost fantomski demonska.",1
"Wilde je tijekom medijske oluje više puta naglasila da se film Ne brini, draga napada iz mizoginije, a ne kritičkih razloga.",1
"Možda, istina, niste vi ti koji se naslađujete, ali vas osjećaj veće vrijednosti dok čitate nečije bljuvotine itekako ispunjava.",1
"Na početku filma upoznajemo kulturu Fremena, autohtonog naroda s Dine, s kojima Paul želi sklopiti savez za bitku protiv Harkonnena.",1
"Kada se k tome još pridodaju nagli izljevi nasilja, Fincher nas udaljava od bilo kakve sigurnosti te u drugom dijelu filma stvara vrlo opipljiv osjećaj napetosti koji plijeni pozornost i tvori jedan solidan film.",0
"Čini se kako Berger voli (filmske) izazove za novi je projekt odabrao ekranizaciju romana ""Konklava"" britanskog pisca Roberta Harrisa.",1
"Taj dio je također novost za franšizu, jer prije nismo imali toliki fokus na jedan lik, izuzev Asha u izvedbi Brucea Campbella.",1
"(Crni) humor u filmu je suptilan, nije nametljiv, pa upravo iz tog razloga i sve šale djeluju poput savršeno serviranih jela.",0
"A on je ovdje nenamjeran, nenametljiv, baš prirodan.",0
