Sentence,Label
"Jer, bez obzira na komentare, nitko me ne može uvjeriti kako je, danas pogotovo, najteže ljude nasmijati i(li) uplašiti filmom.",1
"No, to nije sve leš je oskrvnut iz tijela je izvađeno.srce (??!!).",1
"Ako ste ljubitelj franšize, vjerojatno ćete prepoznati neke tragove koji će vas podsjetiti na prethodnike, uključujući i neke kultne likove, što vam može biti jako sočan dodatak, ali čak i ako vam promaknu to vam svejedno neće utjecati na cjelokupni dojam.",0
"Pa ipak, kasnije se nikako ne može izbjeći osjećaj privatne sumnje, i to u smislu što bi bilo da smo drugačije reagirali.",0
Angažirani smo od prvih minuta do neočekivano frustrirajućeg cliffhangera u zadnjem kadru filma.,0
"Film ima tenziju, daleko od toga da je nema, ali ona se ne stvara, već je ona jednako prisutna od početka do kraja, poput ravne linije.",2
Čekanje.,1
"Prije svega jer se ne ponašaju kao kreteni bez mozga, već svatko od njih ima neku određenu svrhu i smisao.",0
Potom se saziva papinska konklava na čijem se zasjedanju u tajnosti i potpunoj izolaciji od vanjskog svijeta bira sljedeći papa dok je soba preminulog pape zapečaćena i nitko u nju ne smije ulaziti.,1
"Buljim, evo sad već dobrih dvadesetak minuta ispred praznog papira, razmišljajući kako opisati film koji me, baš kako bi rekao Paul, gledajući prostranstva pješčanog planeta, ostavio bez daha.",0
"Istovremeno, Felix otkriva Oliverove tajne.",1
"Ne, ovdje kroz jednostavnost priče imamo uvid u rutinu koju obavlja iz dana u dan jedan ubojica.",1
"Danas su te teme relevantnije nego ikada prije i Villeneuve je toga itekako svjestan, a što se najbolje vidi upravo kroz glavni lik filma Paula Atreidesa.",1
"Kako film odmiče, tako i mi upoznajemo i druge likove, no fokus je uvijek na Fassbenderu.",1
"Primjera je mnogo, najsvježiji je slučaj, za koji je upravo danas stigla presuda za zločin koji je potresao javnost, kada je jedno smeće mučki ubilo svoju bivšu partnericu na poslu.",0
"Prije nego se pitamo gdje je toliko zapelo, mora nam biti jasno da unatoč svojoj naknadnoj popularnosti i hvalospjevima, ni ""Mad Max: Fury Road"" nije bio megahit na blagajnama, već da se po ukupnoj zaradi nije našao među 20 filmova s najvećom zaradom te 2015. godine.",1
Ništa lakše.,1
"Počevši od nametnute pristojnosti prema ljudima koji to ne zaslužuju, preko veza između partnera koje više ne funkcioniraju pa sve do onih puno strašnijih, a zbog kojih će, vjerujem, svakom roditelju iskustvo gledanja filma biti posebno traumatično iskustvo.",1
"Primjerice, kada Amanda i Kramer nešto kažu to možda i zvuči ozbiljno, ali kada znate kontekst onoga što planiraju napraviti, a pogotovo u smislu svega onoga što su radili kroz franšizu, onda to stvara u potpunosti drugačiji pogled na sve ono što su izgovorili.",0
"Nećemo o ljubomori i ljubavi, kao i raznim zavrzlamama izvan filmskog platna.",1
"Ovo, na neki način, i jest Peelovo ljubavno pismo svim onim filmskim djelatnicima koji su itekako zaslužni za stvaranje filma, ali koji nikada nisu dobili priznanje koje zaslužuju.",1
"Malo više od mjesec dana poslije tog, 13. ožujka, papom postaje argentinski kardinal Jorge Bergoglio koji uzima ime Franjo.",1
"Cijeli film je pripovijedan od strane Fassbendera što nam definitivno daje uvid u njegovu psihu i motivaciju, no dosta dijaloga i scena se čini klišejasto.",2
Velika prednost ovog filma svakako su odlični glumci.,1
"Saltburn je kombinacija crne komedije i psihološkog trilera koju je režirala, napisala i producirala Emerald Fenel, dobitnica Oskara za originalni scenario za svoj debitantski film Promising Young Woman.",2
"Jer publika je ta koja koristi svoju maštu, a što omogućuje filmu manje eksplicitnosti kako radnja odmiče.",1
"Naime, uz osmijeh svi većinom vežemo gestu topline i prijateljstva, ali u velikoj većini slučajeva osmijeh zna i prekriti ono što uistinu osjećamo.",0
Zbog toga će uvijek imati moje poštovanje.,0
"Naravno, nije West u njemu napravio ništa revolucionarno, puno je hororaca koji su radnju postavljali upravo na takav način.",1
"Get out je važan film na koji se ""naslanja"" i Nope.",1
"Najbitnije od svega svakako je činjenica što je i ovaj put ""redateljskog crva"" zajahao Denis Villeneuve, jedan od najboljih redatelja današnjice.",0
"Ona se, naime, usudila postavljati pitanja u tom sistemu u kojem se kriju mnogi, pa je samim tim i postala opasan pojedinac, što je i u tom vremenu prošlosti u kojoj se odvija radnja filma čini autentičnom, odnosno nekom vrstom moderne heroine.",1
"Bog je sveprisutan, osjeti se to i u filmu, odnosno u izboru novog pape, povremeno se zna javiti s određenim znakovima koji upućuju da se nešto opasno sprema u Crkvi.",0
"Predviđam kako će Smile dobiti barem jedan nastavak, a nije isključeno ni kako bi jezivi smiješak mogao postati svojevrsna franšiza.",1
"Ne znam da li bih se trebao zabrinuti što sam se prilikom prvog upoznavanja s planetom Dine najviše zainteresirao za kuću Harkonnen, posebice ako pogledate baruna Vladimira, u prvom filmu u izvrsnoj interpretaciji jednog od najvećih glumaca Stellana Skarsgarda, a koji je odbojan na svaki mogući način.",1
"Kao prvo, oba filma su producirala nov (tj. streaming) studiji.",1
"Čak i kada nisu u fokusu oni se itekako osjete, i to ponajviše kroz zvuk, ali i osjet nelagode.",1
"U novije vrijeme, glavni predstavnici uspješnih redateljskih debitanata svakako su Greta Gerwing (Lady Bird) i Alex Garland (Ex Machina).",0
Imamo osjećaj da je to film kojeg smo već gledali bezbroj puta.,2
"Dojam tame dodatno pojačava i kiša čije kapljice osjećamo veći dio filma, a što se čini kao savršena metafora za mračno razdoblje života kroz koji prolaze, pa usudio bih se reći, gotovo svi likovi, uključujući i djecu.",0
"Fargeat tako stvara ""supstancu"" koja omogućuje stvaranje savršen(ij)e slike pojedinca u svakom pogledu.",1
"Projekt redateljskog dua Dana Kwana i Daniela Scheinerta, zaslužnih za vrlo ekstravagantan i hiperaktivan spot DJ Snakea i Lila Jona naziva Turn Down for What, ali i film ""Swiss Army Man"" iz 2016. (film je izazvao odlaske gledatelja za vrijeme projekcije u kinima), koji je dobio trijumfalne kritike kod publike, ali i kritičara.",1
"U tom smislu treba reći kako bi prvi Dune film bez ovog nastavka i dalje bio dobar film, ali zar ne bi bila šteta da je ostalo samo na tome.",0
"Baš kao što su one simbol nastavka i obilja, mlada Furiosa je je sjeme iz kojeg se širi svijet Pobješnjelog Maxa.",1
"Kad je F. W. Murnau radio ekspresionistički klasik iz 1922., a kojeg se Eggers držao radeći svoju verziju, nije zabadava smjestio radnju u Njemačku 1830-ih.",1
"Savršeni kadar traži i Peele i to kroz istraživanje iluzije straha i načina na koji mi tu iluziju doživljavamo kroz spektakl, bilo da se radi o onom životnom ili filmskom, i to sve upakirano u formi ""spektakla"".",0
"Teme kojima se film bavi nisu unikatne kao takve, ali ih film vrhunski izvede radi glume, te se kroz svoje trajanje bavi pitanjima da li bi ljudi izašli iz svoje ljuske da ih se prisili.",1
On je koherentno povezan s ostatkom cjeline i film jednostavno. teče.,1
"Eggers se široj publici prvo predstavio folk hororom ""The Witch"" iz 2015. koji je odmah upisan u moderne kultne klasike, da bi zatim svoj status dodatno podcrtao psihološkom dramom s elementima strave ""The Lighthouse"", jasnom posvetom stilu briljantnog Ingmara Bergmana.",0
"Ranjivost, tjeskoba, strah, sve je to povezano u odličnoj izvedbi Sosie Bacon koja je u svojoj izvedbi podsjetila na Miu Farrow iz kultnog klasika Romana Polanskog, i to prije svega u pogledu nepovjerenja koje prema njoj imaju ljudi u njenom okruženju.",1
"Nakon još strave unutar zidina dvorca, Orlok putuje za Njemačku gdje se nada združiti s Ellen koja ga je slučajnim vapajem probudila iz vječnog sna prije više godina.",1
Blijedoplavo oko gotički je krimić smješten u okolici New Yorka.,0
"Film je prepun takvih ""nervoznih trenutaka"", ali koji nisu u nijednom trenutku jeftini, već su dobro postavljeni u samu priču.",0
Dovoljan razlog za odlazak u kino.,0
Sve do trenutka dok se s njima ne odlučimo obračunati.,0
"Ipak, ""Rise"" je najstrašniji upravo kad djeluje na istoj razini kao i spomenuti ""The Shining"", a to je na području strave u kojoj se roditeljska figura okreće protiv onih koje bi prema svim pravilima prirode trebala štititi.",1
A upravo u tu posljednju kategoriju upao je Saltburn.,2
"Taj trenutak, nažalost, nisam dočekao.",1
Na moje iskustvo gledanja ovog filma zasigurno je utjecalo i to KADA sam ga pogledao.,0
"Twist kojem svjedočimo na kraju u nijednom pogledu nije prethodno opravdan, jednostavno jer nije usklađen s ostatkom priče.",2
"Unatoč tome, Fassbender je izvukao najbolje što može od filma.",0
"""Zašto to radite?""",1
Kod mene to nije slučaj.,1
"U dosta slučajeva imamo neki događaj koji se samo dogodi sam po sebi, bez da uopće ima ikakav utjecaj na daljnju radnju.",2
"U tom pogledu ne treba čuditi što je upravo ""Nope"" prvi njegov film koji je sniman za IMAX, tako da se zbilja isplati pogledati ovaj film upravo u tom formatu jer će tada njegov ugođaj i atmosfera u potpunosti doći do izražaja.",1
Postoji i strah od franšizacije što znači dosadnu reciklažu dosad uzbudljivog materijala.,2
Mogli biste saznati u ovom filmu.,1
"Kal Penn se također nalazi u jednoj manjoj ulozi (kolega s posla), ali itekako bitnoj jer on jedini ima barem donekle neku vrstu razumijevanja prema svemu onome što Rose proživljava.",1
"Speak No Evil stvara takve scene, te čini gledatelje nervoznima dok to radi.",1
"Primjerice, kada recitira pravila strogog i nepristranog pristupa poslu, dok njegovi postupci postaju improvizacijski i emocionalno angažirani.",1
"Furiosu kao djevojčicu upoznajemo u trenutku kada sa stabla skida voćku kao da je u rajskom vrtu, a ubiranjem breskve započinje njezin â€˜pakaoâ€™.",1
"Jeziva glazba za vrijeme odjavne špice možda će vas natjerati na što brži izlazak iz kina, ali zamislite samo kako je onim ljudima koji tu glazbu moraju svakodnevno slušati.",1
"Od samog uvoda filma boje filma su veselije, šarenije, rasplesanije nego što je to bio slučaj kod ""X"".",1
"Na prvi pogled tako imamo tipičan horor film u kojem glavna protagonistica postaje žrtva nadnaravnog fenomena i većinu filma provodi borbom za preživljavanje, odnosno pokušajem razumijevanja svega onoga što joj se događa.",0
"), a ""Nope"" također slijedi sličan obrazac pa se može reći da je istovremeno napet i otkačen, ali i kritičan prema suvremenoj kulturi koja tjera pojedince da u svemu oko sebe traže put do zarade i petnaest minuta slave.",1
Tu bih sada stao kada su u pitanju sve one mane koje zamjeram ovom filmu.,1
"Kadet je obješen o stablo, a idućeg jutra netko mu je ukrao srce.",1
"Saltburn je ekscentrična i provokativna verzija ""Talentovanog gospodina Riplija"" u kojoj se raskošna vizuelna estetika i nastup glavnog glumca ne mogu dovoljno nahvaliti, ali se manje-više pohvale tu i završavaju.",1
Od samog početka McAvoy svojom glumom daje do znanja da s njime nema igre.,0
"Radnja filma ""X"" poprilično je je jednostavna, pa biste samim pogledom na sinopsis mogli pomisliti kako ste to već vidjeli nebrojeno puno puta i kako tu nema ničeg drugačijeg što bi vas zainteresiralo.",2
Nakon toga Ubojica odlučuje pronaći i osvetiti se onima koji su se usudili taknuti u njegov privatan život.,1
"To je nešto što nismo saznali u filmu, a hoćemo i u stvarnosti vrijeme će pokazati.",1
Nekako imam dojam kako M.Night doslovno ima pritisak u smislu da mora snimiti twist kraj po kojem je postao poznat.,1
"Taj tehnički dio itekako je zaslužan i za stvaranje tenzije, što posebno dolazi do izražaja kada je u pitanju zvuk.",0
Victory Village je priobalni grad bez mora.,1
"Treba li se Ribarskog prstena domoći Bellini (Stanley Tucci), Lawrenceov prijatelj koji od svojih liberalnih stajališta neće odstupati ni pedlja?",1
"Vidimo u sjajnoj uvodnoj sceni da je dobila i svoju zvijezdu na bulevaru slavnih, a već godinama je zaštitno lice televizije i voditeljica fitness showa.",1
"Sve to stvara kod gledatelja uzbuđenje i iščekivanje, kao da čitamo knjigu zamišljajući slike koje nam se ostvaruju na velikom platnu.",0
"Zanimljivo je da je odabran kao alternativa robovima ambicija, a već izborom imena pokazuje svoju moguću samoživost.",1
Sve prolazi.,1
"Ne brini, draga (Donâ€™t Worry Darling, 2022) redateljice Olivije Wilde istaknuo se kao najdraža vreća za udaranje na ovogodišnjem Filmskom festivalu u Veneciji i kao najlakša meta filmskih kritičara.",1
"Film tako više djeluje poput vožnje, a manje kao pripovijedanje.",1
"Meni je posebno bilo drago vidjeti tu realnu dinamiku odnosa između brata i sestre, a koja je djelovala stvarno, i to u smislu da im vjeruješ jer nisu fejk, jednako kao što Peele nije fejk režiser.",1
"Ako ste gledali film iz 2022. godine, velika je šansa da ćete se razočarati dok gledate ovaj.",2
"Za franšizu u kojoj smo vidjeli različite verzije ""čudovišta"", ovaj film je itekako uspio pronaći način da me iznova zaintrigira.",0
"Watkins je u velikoj mjeri uspio u svom naumu, bilo kroz kulturološke razlike u odnosu na original koje su vidljive u filmu ili kroz tu našu povezanost s likovima.",0
Ona se kao glavna protagonistica tako savršeno nadopunjuje sa snažnim antagonistom u ulozi Jamesa McAvoya.,0
Dolaskom kardinala i početkom izbora počinju lobiranja i spletkarenja vodećih ljudi Katoličke crkve.,1
"Iskreno rečeno, ne pamtim kada sam se toliko premještao u sjedalu kina kao što je to bio slučaj s ovim filmom.",1
"Pozivnica koja je od strane Chefa Slowika upućena svim tim (kritičarskim) snobovima, zapravo je pozivnica i za nas gledatelje, pa tako imamo posebnu prigodu, istina za nešto manje od 1250 dolara po glavi, uživati u ovom jedinstvenom filmsko kulinarskom meniju.",1
"Usprkos ovom strašnom zločinu, kolege ubijenog kadeta prilično strogo se drže zavjeta šutnje te nerado s Landorom dijele ono što znaju.",1
Vjerojatno nitko ne voli svoje likove manje od Davida Finchera.,2
"To je ono što najviše i nosi osjećaj horora u ovom filmu, a manje sama groteska.",1
"Siguran sam kako sam unaprijed osuđen na poraz kada je u pitanju vjerno prenošenje dojmova filma i to naprosto zato što smatram kako je to nemoguća misija, no barem se mogu potruditi da vam približim barem djelić onoga što sam osjećao prilikom doživljaja na velikom platnu.",1
"Saw X je, dakle, prvi film u serijalu koji je u potpunosti usredotočen na lik Johna Kramera.",1
Posebno se govorilo o jednoj sceni u kadi (da ne otkrivam previše).,1
Iako zapravo kroz film dobivamo natruhe onoga što bi se moglo dogoditi.,1
"No, s druge strane nema znanja za jezik kojim bi to opisala, pa je tako pogrešno shvaćena od društva koji je okružuje, gdje je nitko ne može vidjeti i doživjeti na pravi način.",1
"Toliko toga nisam spomenuo poput ponovno odlične glazba Hansa Zimmera ili Austina Butlera u krvoločnoj izvedbi Paulovog suparnika, Feyda-Rauthe.",0
"Jer, koliko god vanjske stvari djelovale opasno i zastrašujuće, toliko su one unutarnje te koje vam se uvlače pod kožu.",0
"Jer, htjeli mi to priznati ili ne, ima nešto privlačno u likovima koji su cool, zabavni i šarmantni poput onog kojeg je portretirao McAvoy, bez obzira na to što radi stvari kojoj prosječnoj osobi nikad ne bi pale na pamet.",1
"Naravno da Ã–stlund veći dio filma posvećuje plaženju jezika tom opscenom krugu milijardera, ali on svojim filmom osuđuje ljudsku prirodu kao takvu, zlo koje proizlazi iz moći bila ona u rukama kapitalista ili proletera kad je se domognu.",1
"Ipak, svemu usprkos, dvije trećine filma sasvim su solidne, gledaju se lako, a poneka nezgrapnost ne strši previše, no kako se primiče završnica, tako se počinju gomilati problemi.",2
A treba li uopće trošiti riječi na glumca kao što je Christian Bale?,1
"I vi sad cijeli uživljeni raspravljate, recimo o Inceptionu, njegovom kraju, simbolici i sl.",1
"Film kojeg se Charles ne može sjetiti je ""Dvoboj na Missouriju"" iz 1976. godine.",1
"Kasnije će se uspostaviti kako je upravo taj lik, a koji je, da bi stvar bila još čudnija, i pobijedio u toj emisiji, zapravo seksualni predator i serijski ubojica.",1
"Iako to najava možda ne pokazuje, ne može poreći kompleksnost filmskog projekta koji zaslužuje epitet jednog od originalnijih filmova ovoga stoljeća.",0
"Kada film doista pogledate shvatit ćete da osim glazbe i sjajno prikazanog nestvarnog svijeta, nema ništa posebno za reći o njemu.",2
"I dok Jack svaki dan odlazi na posao, njegova supruga za to vrijeme kuha, sprema i tračari zajedno s ostalim suprugama koje žive u toj izoliranoj zajednici.",1
"Ti Fincherovi svjetovi bili su izvrsno skrojeni, bez ikakvih vidljivih šavova postupaka kojima su se gradili, pa je sve izgledalo tako prirodno kao da bi se sve što vidimo u tim filmovima moglo dogoditi upravo i u našem susjedstvu.",0
"To ga ipak ne zaustavi da Furiosu zamijeni za već neku uslugu kod Immortan Joea, a spretna djevojčica bježi od njegovih pohotnih sinova u rudnike.",1
"Istovremeno strašan, jeziv, zabavan, empatičan i razoran.",0
"""Zato jer ste nam dopustili.""",1
"Od njenih manira, načina komunikacije, odnosno općenito ponašanja u solo scenama, jednako kao i s drugim ljudima, bilo da se radi o članovima obitelji ili slučajnim prolaznicima, nama postaje itekako jasno zašto i kako je postala lik kojeg smo upoznali u filmu ""X"".",0
"Na moje iznenađenje, Saw X nije bio smeće.",1
"Michelle Yeoh briljira pritom noseći cijeli film na svojim leđima, kao inačica svojeg lika u beskrajno mnogo verzija, ali nikako ne treba izostaviti ni druge glumce koji su doprinijeli ovom atipičnom šarmu samog filma.",1
"Ili da parafraziramo jedan poznati stih ""tragedije, tragedije, amo."" Peele koristi satiru na jedan pametan način, posebice kroz vizualni dio filma koji, ma koliko ambiciozan bio, u nijednom trenutku ne skreće pozornost sa same priče.",1
Na nama je hoće li te tajne ikada biti otkrivene ili sačuvane.,0
"Priča ""Nosferatua"", posebice atmosfera, činila se kao savršena upravo za Eggersa.",0
"Ne bi me začudilo i da pokupi veliki broj zlatnih kipića jer je to upravo onakva vrsta filma kakvu Hollywood voli, antikatolički, protuvjerski, blještav i sjajan, a tako isprazan.",1
"Florence Pugh je bila i više nego solidna, a Olivia Wilde bolja glumica nego redateljica.",2
Dosada.,1
Seksistička dinamika moći izvrsno se koristi za stvaranje napetosti u filmu.,0
"Znam situacije u kojima su neke divne osobe bile suočene s mogućnosti gubitka svojih voljenih, što je, dakako, dovoljan horor sam po sebi.",1
"To je nešto što općenito cijenim kod hororaca, a što je ovdje itekako prisutno.",0
"Nažalost, koliko god hvalospjeva Konklava zaslužila zbog svojih prvih 110 minuta, tijekom zaključnih desetak u očima nemalog broja gledatelja dotična bi se mogla urušiti poput kule od karata.",2
"I doista, cijeli ""Nosferatu"" djeluje kao film koji je stvoren da vam rasplamsa apetit, te ga već do te scene i sami želite cijeloga proždrijeti.",0
A zasigurno bi vam njegova pojava na trenutke i okrenula želudac.,2
"Baš kako sam spomenuo, prvi kadar i prva scena polažu samu strukturu filma, odnosno povezuje priče u kojima nam postaje jasno što se događa sa stvarnim zvijezdama koje padaju u zaborav.",1
Na taj način i mi lakše shvaćamo zašto se nalaze u situaciji dulje nego što bi realno trebali i smjeli.,1
I u tom smislu Fincher nam je ponudio nešto drugo.,1
"""Speak No Evil"" u svojoj radnji ima točno ono što inače volim kod filmova, posebice kada je riječ o hororima i trilerima, mojim najdražim filmskim žanrovima.",0
U serijal se vraća i Shawnee Smith kao Kramorova šegrtica Amanda Young i njih dvoje provest će u plan neke od najodvratnijih Jigsawovih smicalica dosad.,1
"Murnau nije imao autorska prava na izvornik, pa je u svom uratku izmijenio neke od detalja, pa je tako radnju iz Londona prebacio u rodnu Njemačku, likovima dao nova imena, a naslovno, negativcu i drugačije osobine, no sve to nije bilo dovoljno da ne izgubi tužbu i za kaznu bude prisiljen uništiti sve primjerke svog djela koje je ipak sačuvano na nekim trakama i danas se smatra neizostavnim klasikom i jednim od najutjecajnijih filmova svih vremena.",1
"""Beauty isnâ€™t everything, itâ€™s the only thing"".",1
Prelijepi vizuali i glazba koja uopće nije prisutna dvije trećine filma nam daju uvid da se cijeli produkcijski tim zbilja potrudio da nam da što bolje iskustvo gledanja.,0
"Vizualnost je najveći, ali ne i jedini adut filma ""Nosferatu"" je, prije svega, horor i jezivih scena ima dovoljno (informacije radi za potrebe snimanja filma angažirano je nekoliko tisuća štakora).",0
"Kamera često prati likove, pa čak i kada se maknu iz kadra, mi i dalje znamo da su oni tu u blizini, prisutni i među nama.",1
"Upravo između ""umetničkog"" horora koji ovaj film može predstavljati i avangardnog pornića koji snimaju naši likovi se može povući jasna paralela kakve god kreativne ideje hteli da dodate, ljudima morate ponuditi ono što su, u suštini, i došli da vide.",1
"Nekako imam dojam kako opsjednutost Drakulom leži u činjenici svega onoga što on zapravo suptilno predstavlja, odnosno tabu teme poput seksa i smrti, a što savršeno pristaje puritanskim normama koje i dalje, na neki način, živimo.",1
"Ipak treba pohvaliti odvažne poteze poput dizajna svemirskog entiteta i fantastičnu filmsku fotografiju širokog zapadnjačkog obzorja koju potpisuje Hoyte van Hoytema, najpoznatiji kao suradnik Christophera Nolana na filmovima kao što su ""Tenet"", ""Dunkirk"" i ""Interstellar"".",1
Znate onaj osjećaj kada vas nešto ili netko ugodno iznenadi?,0
Početni pokušaj prevare Poirot će brzo razotkriti no kako minute filma odmiču tako je pred detektivom (i gledateljima filma) sve više izazova koje nije jednostavno objasniti.,1
"Njegovo poznavanje okultnog jako se dobro uklapa u svu tu mitologiju (ne)vjerovanja, ali još bolje pristaje načinu izražavanja koje njeguje Eggers u svojim filmovima, a posebice u ovome.",0
Sve to su jako dobro ukomponirali u scenarij Seth Reiss i Will Tracy.,0
I na koncu dolazimo do Grofa Orloka kojeg je portretirao neprepoznatljivi Bill Skarsgard.,1
"Ako on ostane u vašem tijelu, dulje od 90 sekundi, mogu nastati problemi.",1
"Imam dojam kako kroz svaki lik doslovno možemo vidjeti redateljevu viziju ""Dine"" koja djeluje poput simfonije.",0
"I zaista, pojavit će se njena mlađa verzija u Sue (Margaret Qualley), no kao i svaka pogodba sa đavlom, tako i ova nosi nešto slično.",1
"Puno zanimljivije bilo pratiti tvorca Tetrisa kako je osmislio igru, shvatio njezin potencijal, odlučio ju distribuirati.",0
"Nažalost, imam dojam kako ovaj film i na novo gledanje ne bi otkrio ništa novo, što je uistinu prava šteta.",1
"Osim jump scare sekvenci, jezivu atmosferu stvorit će i grimase raznih likova u filmu.",1
"Pored Alexa, tu je i po meni jako podcijenjeni, a opet tako talentirani Rufus Sewell, čija je uloga možda i najzanimljivija u smislu dojma koji ostavlja na vas.",1
"U središtu radnje filma Nope je afroamerička obitelj Haywood, primarno Otis ""OJ"" Haywood Jr.",1
"U tom smislu treba promatrati i značaj koji ima prema ""Caru"" (Christopher Walken).",1
"Qualley je zapravo kvalitetom otprilike na razini onoga što je pokazala i Moore, no njen lik je napisan na način da nam ne pokazuje iste emocije koje pokazuje njena starija verzija.",0
Uloga mu i dalje itekako stoji i još ima elana i drskosti u sebi.,0
Radnja je koncentrisana na Kramerov lik koji u svom očaju nasjeda na prevaru i pristaje na eksperimentalnu operaciju koja ga može osloboditi karcinoma.,1
A možda bi i izbjegao razočaravajuć kraj.,2
Radnja je smeštena u 1979. godinu i prati filmsku ekipu koja se uputila iz Hjustona na farmu u ruralnom Teksasu kako bi snimili avangardni porno film.,1
"Na određeni način, sam film se bavi nostalgijom i načinom na koji su nas iskustva u djetinjstvu oblikuju, kao i ono što smo doživjeli i konzumirali u društvenom i kulturnom smislu.",1
"Pa ipak, dojam izolacije je i dalje prisutan, posebice zbog činjenice kako se radi o zgradi koja je namijenjena za rušenje, tako da se većina stanovnika iselila, ali ne i naši glavni protagonisti.",1
"Otprilike pola sata filma bavi se seansama i pripremama za ono što slijedi nakon prvog ubojstva ""D film dobiva prepoznatljive konture u mračnom okruženju.",1
A čudovište se tek treba pojaviti.,0
"Naravno, to nije nimalo slučajno, jer je upravo kroz njen lik Peele na jedan mudar način ubacio onu suptilnu dozu humora u tenziju horora.",0
Danijeli ponovno iznenađuju.,1
Potrebno je samo trgnuti se iz vječnog sna.,2
"Zaključenje posla prilika je koju Thomas ne želi propustiti za sebe, ali i za voljenu Ellen.",1
Ono što bih također želio posebno pohvalitit definitivno je suptilni crni humor koji je prisutan u filmu.,0
"""Od svih ljudi koje ste mogli prevariti, vi ste odabrali Johna Kramera?""",1
"Ni manje ni više, na ekranu se pojavljuje mladi Edgar Allan Poe (Harry Melling), tada također kadet Vojne akademije West Point (faktografija je ovdje na mjestu).",1
"Za glazbu je bio zadužen Bergerov suradnik Volker Bertelmann (također radio i na sjajnoj seriji ""Operacija Šakal"" čiju ćete recenziju uskoro moći čitati na Ziher.hr).",1
Prezentacija samih jela itekako je narativno privlačna.,0
"Nisu mi se dopali likovi tinejdžera sa svojim odbojnim ponašanjem, ali je film u isto vreme i užasno surov i empatičan.",1
