Sentence,Label
"U glavnim ulogama zatekli su se legendarni Christian Bale, naš protagonist, te Harry Melling, deuteragonist koji glumi ranije spomenutog Edgara Allana Poea.",1
Kendrick koristi četiri ključne razine priče.,1
"Kada na filmu dobijete priliku surađivati sa takvim talentima, onda znate kako će konačni rezultat biti itekako zadovoljavajući.",1
Razmišljamo li ikad kakvu glazbu plaćeni ubojica sluša.,1
"Po američkom zakonu, kao civila ga sud poziva za porotnika na izvršenje obveze građanske dužnosti u suđenju koje ga se tiče, ispostavlja se u uvodniku filma.",1
"Film također nikada ne postaje naporan i dosadan , jer si cijelo vrijeme investiran u njega i čekaš da se nešto dogodi što će imati utjecaj na daljnji tijek događanja.",2
"(Nije vijest za gledatelje franšize, ali odmah je relevantna za ono što će se odvijati u filmu.)",1
"Pa ipak, jasno mi je da je cilj prvenstveno bilo razmišljanje o onome što gledamo kroz kadar, ali i sam odnos između likova.",1
"Autor osnovnoj postavci pruža neočekivanu dozu napetosti, a neki put i humora, naročito u scenama kada su likovi blizu da shvate ozbiljnost svoje situacije, ali tu priliku propuštaju.",1
"Prvo što zapažamo je vizualna spektakularnost, Berger i njegov direktor fotografije Stephane Fontaine zaista imaju dobro oko za filmsku sliku, uspijevaju aranžirati i koreografirati iznimno atraktivne prizore, kako u rovovima Prvog svjetskog rata, u kojima im je doduše pomogla i ekipa za specijalne efekte, tako i u vatikanskim odajama i dvorištima koji su sami po sebi specijalni efekti.",2
"Taj Vest to i radi, zadržavajući našu pažnju činjenicom da su mu i likovi zanimljiviji i dopadljiviji nego što sam očekivao, odnosno da neki od njih imaju dubinu koja nije baš karakteristična za ovakav tip filma.",0
"Onda usred glasanja zaista eksplodira bomba i površno rani neke od kardinala u sekvenci za koju sam se nadala da se samo fantazija ili san, da ne govorimo o potrebi za izolacijom dok jedan od kardinala neprestano traži informacije iz vanjskog svijeta poput amaterskog detektiva.",1
"Jer, obzira u kakvim filmovima glumio, gotovo je sigurno kako će on biti na visini zadatka.",0
"Pri kraju, Kramer se pridružuje grupi za podršku raka i upoznaje čovjeka po imenu Henry Kessler (Michael Beach) koji će mu kasnije ispričati o čudesnom lijeku protiv raka i da mu je to spasilo život.",1
To su samo neki od glavnih motiva i tema s kojima se bavi drugi dio prve knjige Dune.,1
"Umjesto toga, treba ilustrirati stvarna zla svijeta uz nedjela fiktivnog lika.",1
"Jer, čak i ako ne poželite malo kopati dublje u potragu za skrivenim porukama, smatram kako ćete svejedno uživati u ponajboljem horor filmu ove godine, što Smile svakako jest.",1
"Jer kad nas pravi život udari, ne možemo puno razmišljati niti o ambiciji niti smislu života, već se snalazimo kako znamo i umijemo.",1
"(Dopustite ovdje kratku digresiju; domaći distributer naslov filma je mlako preveo kao ""Nikako"" premda bi mnogo zgodnije bilo da se odlučio za vrckaviju varijantu s, primjerice, ""Jok"".)",1
"A kada je u pitanju moderni horor, onda su tu svakako nabolji predstavnici Robert Eggers (The Witch), te, naravno, Jordan Peele s filmom ""Get Out"".",0
No Elisabeth je u godinama koje Hollywood baš i ne voli.,1
Možda u nekom drugom svemiru.,0
"Nego da je za njega bitniji vizualni prikaz radnje, tzv. Visual storytelling.",1
"Tada se ono Fincherovo testiranje, a koje sam prethodno spomenuo, itekako isplati.",0
"Pa ipak, put do groteske je poprilično dug, pa se tako u samom početku filma stječe dojam da nas je redatelj, poput kakvog šamana, sjebao nekim teškim psihodelicima.",1
"Brutalna je to i groteskna satira ne samo i o starenju i show biznisu, već i o seksualizaciji i objektivizaciji mladih i lijepih žena u današnjem društvu.",1
Ovdje će se pak stara i mlada verzija iste osobe samouništavati iako one ne mogu istovremeno ni egzistirati jedna uz drugu.,1
"Crkva se svake godine suočava s mnogim problemima s najvećim naglaskom na pedofiliju o kojoj se baš previše ne priča, a i kada se priča onda se ništa pretjerano ne čini po tom pitanju.",1
Pogledajte ga!,1
"Vodi samo onu bitku za koju si plaćen."".",1
"Snimanjem porno filma koji West koristi kao glavnu premisu, ujedno se i stvara film u filmu, što opet dodatno rađa i njegovu određenu dualnost, jednako kao što to radi i za same likove.",0
"Nakon što je snimio ""U dolini nasilja"", svojevrsnu kombinaciju vesterna, trilera i crne komedije, West je uzeo šestogodišnju pauzu od snimanja filmova pa je u tom periodu snimio petnaestak epizoda za različite serije, gdje bih svakako izdvojio onu za ""The Exorcist"".",1
"No, daleko od toga da ne postoje situacije koje će vam stvoriti neugodne trnce po tijelu, i to sve u stilu klasičnog horor/triler filma.",0
"Ako ste nevini, ne morate se boriti za svoj život.",1
"Pomalo frustriraju zamke koje je Jigsaw osmislio za ovo izdanje; dosta ""igrača"" završi na isti način, i čini se da je to odluka scenarista kako bi ostvarili predvidiv epilog.",2
"Iako nam se neki postupci protagonista mogu činiti nerazumnima, upravo je on glavni razlog, posebice kada u cool stilu ubaci šarm ispod zlokobne unutrašnjosti, zbog kojeg ostali likovi počinju sumnjati u svoje instinkte.",1
"Jedan od razloga je što obično nema ništa strašno u njima ili su jednostavno slabije kvalitete, a oslanjaju se na veliki broj klišeja.",1
"Jako bitan lik u filmu je i njegova sestra, Gwen, a koju glumi talentirana Madeleine McGraw.",1
"No, bez obzira što nismo u prilici vidjeti Finchera u kinu, nekako sam uvjeren kako nećete pogriješiti ako u toplini svog doma krenete na ovo uistinu ubojito putovanje koje nam je pripremio stari majstor režije.",0
I to bi kao trebao biti uvjerljiv jump scare?!,0
"Ono što ostaje jest izmješten čovjek, uronjen u naviku i dosadu kojemu osveta dođe kao prilika za bijeg od samog sebe.",1
"Tetris je zabavan film, ali je za razliku od igre na kojoj se temelji potpuno zaboravljiv.",2
"Najbolji primjer svakako je bio Sam Raimi koji je oduševio publiku sa svojim horor prvijencem ""Evil Dead"".",1
"Unatoč predvidljivoj radnji, Smiješak će vas cijelo vrijeme držati u neizvjesnosti.",1
"Ima nešto plemenito u gledanju tako determiniranog i samouvjerenog umjetnika na djelu, iako je Fincher, baš kao i njegov lik u filmu, ovoga puta promašio metu.",1
Redatelj Derrickson stvorio je dojmljivo jeziv ugođaj u kojem kao glavni negativac briljira Ethan Hawke.,1
"Naravno, on tu slabost pokušava sakriti, a u tome mu itekako pomaže Irulan, odnosno njega snaga koja djeluje kao ravnoteža njegovoj ranjivosti.",1
"Istina, ali onda to pokažeš na taj način, a ne stvarajući kontraefekt svega onoga što si prvotno želio postići.",2
Izbor pjesama se tako čini kao savršen alat za ublažavanje njegovih briga i izazova s kojima je suočen.,0
I on je u ovoj ulozi doista dobar.,0
"Sjajno se ""The Menu"" izruguje s tim i takvima, ali i s onim bahatim i bogatim snobovima uvjerenim da s novcem mogu kupiti sve.",0
"Općenito, suptilna interakcija između likova i stvara ton filma, a koji s odmakom vremena postaje sve neugodniji i nasilniji.",0
Izbori za prvog među jednakima prožeti su previranjima između tradicionalista i liberala te je na Lawrenceu da osigura integritet izbora u jeku skandala koji potresaju ovu tisućljetnu instituciju.,1
"Ako bismo tražili sljedeći Poor Things, onda možemo reći kako je The Substance jako blizu.",1
"Osim života, izreka u potpunosti odgovara filmografiji Indijca M.Night Shyamalana.",1
Svi oni i drugi očekuju da će za vrtoglav iznos koji su uplatili dobiti nezaboravnu večeru.,1
"Jer, zapravo, svi bismo trebali imati sličan, ako ne i u potupunosti isti pogled na ovaj film, odnosno temu koju obrađuje.",1
Na njoj se stari po godinu dana u pola sata što znači da svi na plaži imaju jako malo vremena da nađu izlaz.,1
"Fincher tako započinje prvo poglavlje u kojem neimenovani ubojica (Fassbender) čeka svoju metu nekoliko dana, a za to vrijeme imamo priliku upoznati ga kao lika kroz njegov niz isprekidanih, ciničnih (ili kako bi Ubojica rekao, pragmatičnih) komentara.",1
"Primjerice, njezin stan je odraz njenog fizičkog i psihičkog stanja, posebice kada slučajno čuje kako je šef, seksistički egoist, prigodnog imena Harvey (Dennis Quaid) na poslu voditeljice fitnes emisije planira zamijeniti mlađom i seksepilnijom.",1
Neovisno o tome koliko je njihova vjera snažna i koliko je dugo slijede.,1
Druga najčudnija stvar u vezi ovog filma je apokaliptični zaplet koji se odvija oko najstrašnije more svakog Amerikanca revizije poreza. A treća stvar je izvedba.,1
"Čak i kada su djeca u pitanju, što je poprilično teško za postići, taj emotivni most redatelj također nikad ne uspije sagraditi.",1
"Glavno lice filma ""X"" u svakom mogućem pogledu bila je Mia Goth, koja je bila jednako uvjerljiva u dualnosti svoje uloge.",0
"Hoće li na Svetu Stolicu zasjesti svim mastima premazan Tremblay (John Lithgow), nadmeni Tedesco (Sergio Castellitto) koji još uvijek oplakuje tridentsku misu ili, pak, tamnoputi Adeyemi (Lucian Msamati), a čiji bi izbor predstavljao povijesni presedan?",1
"Dapače, Saltburn se pokazao bolno prosječnim filmom.",1
"Čak je i Harry bio bolji u ""Dunkirku"" kad je šutio, nego u ovom filmu.",1
"Dakle, možeš u nekom određenom trenutku biti najbolji od svih, ali to jednostavno nije dovoljno.",1
Takva odluka funkcionira izvrsno u trenucima kada se Bezgrešna osokoli i odmakne od banalnih zastrašivanja i monotonih kadrova u mrklom mraku.,1
"Snimljen je prema bestselleru Roberta Harrisa, inače vrlo uspješnog i solidnog pisca prema čijim romanima je Roman Polanski snimio dva dobra filma, Pisac iz sjene i Časnik i špijun, dok su mu ranije već ekranizirani romani Domovina i Enigma.",1
"I zaista, The Substance ne oklijeva od gadljivih i grotesknih kadrova.",1
"Njih dvoje imaju vrlo dobru dinamiku, te se njihove osobnosti jako dobro poklapaju, S druge strane, Mackenzie je samo OK dok Scootova gluma ne pridonosi filmu kao takvom, ali zbog McAvoyjeve glume dolazi nešto više do izražaja.",1
"Moja navika da nakon svakog filma odgledam odjavnu špicu do samog kraja dobila je nagradu upravo kroz završnicu filma ""X"", kada je na moje opće oduševljenje stigla najava za prequel filma pod nazivom ""Pearl"".",0
"Nije stoga ni čudo da je postao inspiracija za mnoge redatelje, pa tako i za Roberta Eggersa koji je više od stoljeća od premijere originalnog Nosferatua odlučio snimiti remake koji upravo gledamo u kinima.",0
"I koliko god ova posljednja rečenica zvučala neskladno s ostatkom priče, ona se zapravo savršeno uklapa u nju.",1
"Tijekom istrage odnosno ispitivanja detektiva Poirota otkrivaju se sudbine prisutnih kroz njihove priče redatelj tematizira teizam i ateizam, ratne veterane slomljene PTSP-om, pohlepu i beskrupuloznost, migracije.protagonisti nisu jednako zanimljivi, ali ambicija dubljeg prikaza likova ne može se osporiti.",1
"A kad se i pojavi nada bilo koje vrste, u ovom slučaju ružno pače za sve kardinale u konklavi, kada ugledate svjetlo na kraju tunela onaj najmanji prst barem jedne ruke ipak je ostao u pekmezu.",1
"Užitak u koji je ona uvučena, i mi smo kao gledatelji uvučeni zajedno s njom.",0
"Bilo zbog toga što je na setu koji je ograničen na kuhinju lakše osigurati kovid mjere ili zato što su teme izvrsnosti, zajedništva i prehrane (tj. preživljavanja) dobile novo značenje.",1
"Što film odmiče kraju, to postaje sve groteskniji.",1
"Njegov lik ima određenu dozu empatije, bez obzira što je smatra slabošću, ali i apatije.",1
"Plaža i more jedino su što ""Ostarjele"" povezuje s terminom ljetni blockbuster ovaj se film bavi vječnim ljudskim pitanjima i sumnjama, kraj filma gledatelja (o)stavlja gledatelja u razmišljanju o čitavoj priči.",1
"On je zanimljiv, otkačen i prijeteći.",0
"Od Zendaye nisam očekivao puno što se tiče glume, ali mora se reći da je i više nego solidno utjelovila Chani u filmu.",1
"Kada je u pitanju konačna ocjena za ""Pearl"", onda mogu samo reći kako mi je u istom rangu kao i ""X"".",1
Uz pomoć suvremene tehnologije i solidnog budžeta mogao je uvjerljivije uprizoriti što mu je mašta prohtjela.,0
"FILMSKI su trendovi varljivi, štoviše nepredvidljivi, evo recimo filmovi i serije o papi.",1
"Koliko god Lawrence kao predsjedajući u konklavi u potpunoj izolaciji ne smije utjecati na glasače, toliko sve više istražuje smrt pape i događaje netom prije smrti.",1
"Ne krši te zakone tijekom filma samo kako bi dobio neku zanimljiviju scenu, koja se zapravo kosi s cijelim narativom.",1
"Da se razumijemo, nemam ništa protiv dugog bildanja atmosfere, uostalom to ovdje jako dobro funkcionira u prvih sat vremena filma, ali nakon toga to jednostavno postaje previše repetativno, što gubi svaki smisao u pogledu napetosti.",2
Redatelj West i Mia Goth uspijevaju zajedničkim snagama stvoriti i određenu empatiju koju osjećamo prema Pearl.,0
"Peele koristi nadnaravne sile kako bi skrenuo pozornost na probleme koji muče američko društvo, ali i moderno društvo općenito.",1
"Serija ""Loki"" (2021) i film ""Spider-Man: Put bez povratka"" (2021) načeli su priču o multiverzumu, a dodatno ju je elaborirao najaktualniji film redatelja Sama Raimija, ""Doktor Strange u Multiverzumu Ludila"" (2022).",0
"Berger i Harris mnogo pažnje poklanjaju vjernoj rekreaciji protokola koji se događaju tijekom konklave, što je za gledatelje jako zanimljivo, barem u početku, dok bi napetost filmu trebala osigurati pomalo trilerska priča o podmetanjima kojima ambiciozni kardinali pokušavaju izbaciti konkurente iz utrke dok istovremeno lobiraju za glasove, pa se Trg svetog Petra tih dana pretvara u Koloseum.",1
"Ili još bolje, čemu je Henkova prevoditeljica zapanjujuća ljepotica.",0
"Ono što mene uvijek iznova oduševi kod Peela, prije svega je način na koji on priča priču.",1
"Elegantna, ranjiva, luda, i sve to upotpunjeno emotivnim i fizičkim skidanjem koje nam pokazuje koliko kritički možemo gledati na sebe, ali i druge ljude.",1
"Za vrijeme uobičajenog radnog dana, u ordinaciju dr. Rose Cotter ulijeće ustrašena i izbezumljena studentica.",1
"Jasno je, dakle, da se mnogo očekivalo od ""Furiose"" najnovijeg izdanka sage o Mad Maxu koji donosi tzv. origin story glavne protagonistice ""Mad Max: Fury Road"" kojeg su kritičari obožavali, a Akademija ga je zasipala cijelim slapom Oscara u tehničkim kategorijama.",1
Shyamalan jako dobro koristi tijelo kao horor promjena u možda najboljoj sceni filma sa glumicom Abbey Lee.,1
"Ovdje je ta jednostavnost oslikana kroz lik koji nam je bio poznat samo po imenu, ali ne i po karakteru.",1
"Drugi dio, pak, puno je mišićaviji, snažniji, moćniji, jednako kao i Paul.",1
Sam naziv filma itekako je simboličan.,1
"Ti su kadrovi djelovali poput sna, ali onog koje sanjate širom otvorenih očiju.",1
"Naravno, redateljska gromada je govorila u metaforičkom smislu, misleći na pogled na teme koje neki filmovi obrađuju.",1
"I kako idemo dalje, duboko u pijesak Dine, tako pratimo Paula koji traži osvetu, rastrganog između velike ljubavi i sudbine koja mu je namijenjena i za koju zna da dolazi.",1
"I to je ono što je mene osobno najviše uznemirilo, činjenica da upravo takvi likovi na neki uvrnuti način bilo što mogu predstavljati, a kamoli ono najvažnije život.",1
"No, problem nastaje kada ta moć nestane, a tada i West skreće u temu prolaznosti vremena, straha od starenja, odnosno svih posljedica neostvarenih snova.",2
"Srećom, izlizani klišej ukletog samostana dobrano mijenja iznenadna Cecilijina trudnoća.",1
"Mylod nas pokušava natjerati da se kao manje imućna klasa naslađujemo patnjom onih koji imaju više od nas, kao da nam razlika u prihodima automatski daje pravo da se osjetimo moralno superiornima njegovim likovima, premda u najvećem broju slučajeva nema opravdanja za takvu stancu.",1
"Jer, svake godine jedan film u ovom žanru iskoči i postane vrlo popularan.",1
Rad kamere podiže osjećaj paranoje sa svakom novom scenom.,1
"Referenta točka kada je u pitanju neprikazivanje nasilja svakako je film ""Nema zemlje za starce"", braće Cohen.",1
"U velikoj mjeri to možemo zahvaliti i načinu na koji je snimio pojedine kadrove, posebice kroz 8mm film, a koji su itekako podsjetili na stil koji je koristio u Sinisteru.",1
Realnost same priče najviše stvara upravo iskustvo koje je proživjela glavna junakinja.,1
"No tek kada sam odgledao Sve u isto vrijeme, shvatio sam koliki kinematografski potencijal ima koncept multiverzuma.",1
Pozvani gosti pristaju i kreću na kratki izlet koji će trajati puno duže nego što posjetitelji plaže misle i planiraju..,1
Zašto ne?,1
Fargeat na taj način stvara neku vrstu feminističkog body horora i to kroz svijet u kojem postoje posebna pravila i gdje se stvari guraju do krajnosti.,1
"Dodamo li svemu tome i pretjeranu minutažu u trajanju od dva i pol sata, mogli biste pomisliti da je u pitanju velika gnjavaža.",2
"Ta naracija u prvom poglavlju čini se kao nespretna adaptacija istoimenog stripovskog predloška, jer unutrašnje misli lika koje tako prirodno teku u mediju stripa, u ovom filmu činile su se prekomjernima i zamornima, tim više što nije bilo radnje između koja bi nam dala predaha od niza varijacija na temu besmislenosti svijeta.",2
"Uostalom, snimio je Blade Runner 2049, nastavak kultnog filma Ridleya Scotta, a što je, vjerujem, bio također iznimno zahtjevan zadatak kojeg je, srećom, uspješno položio.",0
"""X"" je film od kojeg u startu nisam znao što očekivati, da bi na kraju ispao jedan od najboljih horor filmova godine.",0
Taj trokut zatvara Joy koja je tužna i razočarana.,1
"Scenarij filma napisao je iskusni britanski dramatičar i scenarist Peter Straughan (""Dečko, Dama, Kralj, Špijun"").",1
Njegovo ime je Edgar Allan Poe.,1
"Nažalost, film ne donosi ništa novo.",2
"Vjerojatno najčudnija stvar u vezi filma Sve u isto vrijeme (Everything Everywhere All at Once, 2022) je da iako je riječ o multiverzumu, ovo nije Marvelov film.",0
Uporedo je sniman prikvel ovog filma pod nazivom Pearl koji se trenutno nalazi u post-produkciji.,1
"Jer u svom središtu, ovaj film, ova priča, pita se: ""kako je Edgar Allan Poe postao onakvim kakvim ga znamo"".",1
"Društvo koje je spremno prihvatiti bilo kakvu vrstu udobnosti, u kojem je cilj pojedinca biti dio sistema jer ima privid da ga na taj način takav sistem štiti, bila je glavna nit vodilja ovog filma.",0
"To sam najviše osjetio u pogledu pogađanja ""koja će cura biti glavna u samoj završnici"", gdje imamo slatku i nevinu Loraine (Jenna Ortega), seksualiziranu Bobby (Britanny Snow) i samouvjerenu Maxine (Mia Goth).",1
"Spomenuta scenografija, mračan ugođaj palače koja je nekada bila ljepotica Venecije dok je sada zlokobno mjesto mrtvih uvod su u priču.",1
Sve dok ne otkrije da je sve na otoku na meniju.,1
"Svatko je zanimljiv na neki svoj način, počevši od glavnih protagonista pa sve do negativaca.",0
"Ispostavit će se da je Supstanca neka vrsta seruma koji stvara mlađu, ljepšu, perfektniju verziju samog sebe, a razočarana i ogorčena Elisabeth odlučit će se probati taj serum.",1
"Glumačke izvedbe veliki su, najveći adut filma.",0
"U glavnim ulogama su Daniel Kaluuya, Keke Palmer i Brandon Perea.",1
"I to od one vrste koja je skrojena da izazove vau efekt, ali ne i da mu da smisao.",0
"Tijekom tog putovanja između prošlosti i sadašnjosti, zapravo su boje te koje određuju naš sud prema likovima, posebice prema Harper.",1
"Čudovišta su oko nas, neka nose maske, neka su bez njih.",1
Većina tih pitanja proizlazi upravo iz njenog odnosa s majkom.,1
"Meni su likovi u originalu strašno išli na živce koliko su bili glupi i nezainteresirani za borbu za preživljavanjem, tako da prema njima nisam imao nikakvu empatiju, ma koliko god film bio neugodan.",2
"Iako film ima dobrih dijelova, klasičnu napetost koja odlikuje svaki dobar triler, odličnu glumačku izvedbu Michaela Fassbendera te Tilde Swinton koja se nažalost samo kratko pojavi na ekranu, The Killer ne nudi ništa novo.",1
"Scene koje se možda i ponavljaju, u nijednom pogledu ne spuštaju taj pulsirajući dojam, već upravo suprotno neugoda postaje sve veća, tako da doslovno imate osjećaj kao da se utapate u vodi depresije i anksioznosti.",1
Zanimljiva je priče koja je prethodila snimanju i realiziranju filma.,1
"Ovo je uistinu film atmosfere, tako da je bilo jako bitno da se kratka priča u potpunosti, ponajviše u tom pogledu, prenese na sam film.",1
"Da može odigrati i drugačije uloge, van nekakvih klišej uloga teenagerskog ljepotana, dokazao je i u filmu ""Bones and All"", a bogami i u ovom nastavku filma ""Dune"" kojeg doslovno nosi na svojim leđima.",0
Ali ima romantizam i svoju drugu stranu.,1
"No, s druge strane ni jedan, ni drugi nisu nevini, imaju svoje najdublje tajne koje će se postepeno otkrivati, Lawrence je zapravo jedino kriv što je otpečatio papinu sobu i iskoristio određenu dokumentaciju za utjecaj na glasovanje, dok Tremblay ima jednu puno dublju tajnu koja je povezana i sa samim papom.",1
"I da, istina je da se u filmu skupila jako dobra glumačka postava.",1
"Ta neugoda koja nastaje u Rose stvara i u nama posebno iskustvo, pogotovo što imate osjećaj kao da joj stalno dišete za vratom.",1
"I dok ih Hareper vidi i u onom fizičkom smislu kao različite osobe, mi s druge strane tu različitost primjećujemo kroz njihovo ponašanje prema njoj, odnosno kako njihovi postupci djejuju na njeno viđenje stvari.",1
"U vizualnom smislu film je prava poslastica ne samo za ljubitelje znanstvene fantastike, već i filmova općenito.",0
"I bez obzira na to što imamo ograničeno vrijeme da ih upoznamo, prostor u kojem ih stavlja redateljica dovoljno govori o složenosti njihovih života, izvan konteksta tog nasilnog trenutka s kojim se moraju suočiti, odnosno prikazivanjem detalja koji nas upoznaju s njihovim životom koji su živjele ranije.",0
"Prije negoli se otisnuo u filmofilske vode, posebice one redateljske, Alex Garland je bio poznat kao odličan pisac.",1
Redatelj â€˜Konklaveâ€˜ Edward Berger ima smisla i za estetiku i za dramu.,1
"Svega toga ima i u Fincherovom najnovijem filmu ""The Killer"", svega osim ovog potonjeg.",1
"Thomas odlazi, ali ubrzo nakon odlaska Ellen počinje sanjati sve mračnije snove dok je Thomas suočen s domaćinom kakvog još nikada nije vidio ili upoznao.",1
"Vizije glavne protagonistice, a koje su i pokrenule čitav niz događanja, prečesto se ponavljaju u istom ritmu, pa tako umjesto polaganog stvaranja tenzije dobijemo sasvim suprotan efekt.",1
"Kasnije je Garland napisao scenarij i za film ""Dreed"", da bi, konačno, 2014.godine snimio i svoj prvi dugometražni redateljski film u karijeri ""Ex Machina"".",1
Zašto prividnu?,1
"Iako je sekvenca u kojoj na taktove ""How Soon Is Now"" bezimeni (anti)junak snajperom pokušava koknuti svoju metu izrazito efektna, nakon jedno desete pjesme sve počne nalikovati na nekakvu fanovsku kompilaciju s YouTubea.",1
"""Meni"" je film od kojeg sam nakon prvog gledanja trailera imao velika očekivanja.",0
"Od samog početka kada su njih dvojica u sceni, McAvoy svojom glumom daje do znanja da s njime nema igre.",0
"Sam izgled ranča na kojem se odvija radnja filma, uz onu glazbu koja odzvanja u pokvarenim zvučnicima, sasvim je dovoljna kombinacija za rađanje osjećaja jeze.",0
"Iako znamo da je naša reakcija bila sasvim opravdana, štoviše čak i poželjna, taj osjećaj sumnje stalno je prisutan među nama.",1
"U fizičkom pogledu on djeluje bezlično, nosi jednako takvu odjeću, tako da nepoznavanje njegovog pravog imena savršeno pristaje toj njegovoj pojavnosti.",0
"Ali opet, nekako mi prevladava (znati)želja, tako da se osjećam poput onog pustinjskog miša Muadâ€™Diba koji stalno kopa po onom pijesku, pa zašto onda i ne pronaći još jedno uzbudljivo poglavlje svijeta Dine.",0
"Taj element slabo zahvaćene svakodnevice postaje još važniji kad se u obzir uzme Ubojičin komentar gdje se on svrstava među većinu ljudi, što znači da dijeli njihova razmišljanja i aspiracije.",2
"Koliko god Hawke bio odličan u svojoj ulozi, ako se mene pita glavno ime u onom glumačkom smislu ovog filma svakako je mladi Mason Thames u ulozi Finneya.",0
"Kada smo već kod tih odnosa, onda bi bilo najbolje to sve staviti pod zajednički nazivnik kroz odnos koji Rose ima sa svojom sestrom Holly (Gillian Zinser).",2
Dva različita i na prvi pogled u potpunosti nespojiva filmska žanra.,1
"Na zadovoljstvo svih filmofila, ili barem velike većine, Fincher je i dalje u punoj filmskoj snazi.",0
"Da, puno je tema koje se mogu pročitati (ili interpretirati) iz priče ""Nosferatua"".",1
"Treba također reći kako je sam scenarij bio na poznatoj hollywoodskoj ""crnoj listi"", tako da mi je itekako drago što je napokon došao na glavni meni, jer nam u svijetu kopija itekako nedostaje ovakve originalne ""hrane"".",1
"Kada u nekom izboru imate kandidate od kojih su apsolutno svi upetljani u neke vrste tajni koje se tek trebaju otkriti, onda je jasno da je teško doći do dvotrećinske većine u konklavi.",1
"Nakon ""Svjetionika"" Eggers se odmaknuo od horora i kreće u realizaciju povijesne drame/pustolovine Sjevernjak film koji je ponovo spojio Taylor-Joy i Eggersa.",1
"Mi na to putovanje kroz studij njegovog lika krećemo od samog početka, zapravo zajedno sudjelujemo u njegovom razvoju, i to u filmu odlično funkcionira upravo zahvaljujući njegovoj izvedbi.",0
"Peele je, inače, osvojio Oscara za svoj film Get Out, koji je također bio horor-triler.",1
